index,date_published,date_modified,source,sponsor,title
481,2017-12-04T13:27:53,2017-12-04T13:27:53,telegraaf,Get_into_the_Future,’Wij willen de Tesla van de energiemarkt zijn’
482,2018-10-25T10:37:00,2018-10-25T10:37:57,telegraaf,NS,‘In een kwartier van Utrecht in Amsterdam’
483,2018-10-11T04:00:00,2018-10-11T07:29:46,telegraaf,NS,‘Na die weddenschap neem ik vaker het openbaar vervoer’
484,2018-08-02T06:45:00,2018-08-02T06:46:20,telegraaf,NS,‘Ik verkoop zelfs zonnepanelen in de trein!’
485,2018-07-12T04:00:00,2018-07-12T13:54:28,telegraaf,NS,Eigen baas dankzij de trein
486,2020-12-10T08:31:00,2021-01-13T14:36:17,ondernemer,mercedes-benz,Getest door ondernemers: de nieuwe Mercedes-Benz EQV
487,2020-12-03T08:47:00,2020-12-03T13:58:21,ondernemer,mercedes-benz,Meer dan holle marketing: waarom de Mercedes Van ProCenters echt handig zijn voor bestelwagenrijders
488,2020-11-26T09:56:00,2020-12-03T13:56:06,ondernemer,mercedes-benz,Elektrisch rijden duurder zeg je? ‘Alles draait om de TCO’
489,2020-11-19T10:20:00,2020-12-08T11:18:55,ondernemer,mercedes-benz,Ook Noot gaat elektrisch: ‘Voor personenvervoer kunnen en wíllen we niet anders’
490,2020-11-09T14:28:00,2020-12-08T11:21:48,ondernemer,mercedes-benz,Judith Eyck (Zoover) over toekomst van toerisme: ‘Het wordt tijd dat we Europa herontdekken’
491,2020-10-23T09:32:00,2020-12-08T11:23:31,ondernemer,mercedes-benz,Topschilder Roodnat test de elektrische eSprinter: ‘Dat gaat super ik ben benieuwd naar de cijfers’
492,2020-10-21T12:35:00,2020-12-03T13:52:03,ondernemer,mercedes-benz,‘Onze bestelwagens maken elektrisch rijden aantrekkelijk voor – bijna – alle ondernemers’
493,2021-01-10T20:50:00,2021-01-26T13:09:30,ondernemer,engie-energie-2,Zó maak je van laadpalen bij je bedrijf een duurzaam verdienmodel
494,2020-12-08T10:39:00,2021-01-12T10:18:59,ondernemer,engie-energie-2,Hoe ondernemers omgaan met duurzaamheid en zichzelf scherp houden
495,2019-09-24T10:22:00,2019-11-12T10:04:50,ondernemer,engie-energie-2,Zowel online als in de winkel duurzaam: ondernemen is continu innoveren
496,2019-09-06T15:13:00,2019-09-23T16:44:39,ondernemer,engie-energie-2,Deze architecten bouwen aan een duurzamer Nederland
497,2020-12-17T10:00:00,2021-01-28T13:14:31,ondernemer,abn-amro-meespierson,‘Ik wist vanaf de eerste financiering dat ik mijn bedrijf zou verkopen’
498,2020-12-15T14:38:00,2021-01-28T13:06:40,ondernemer,abn-amro-meespierson,Filantropie: meer betekenis geven aan je vermogen
499,2020-12-11T12:00:00,2021-02-01T15:23:40,ondernemer,abn-amro-meespierson,Bedrijfsoverdracht in coronatijd: behoefte aan overzicht en inzicht
500,2020-12-08T08:44:00,2021-01-28T12:18:30,ondernemer,abn-amro-meespierson,Slimme stappen bij bedrijfsoverdracht
501,2020-11-19T13:00:00,2021-02-01T15:37:23,ondernemer,abn-amro-meespierson,Een bedrijf verkopen doe je niet alleen; je vermogen beheren ook niet
502,2020-11-19T13:00:00,2021-01-28T13:17:42,ondernemer,abn-amro-meespierson,‘Ik ben meteen na de verkoop naar de Porsche-dealer gereden’
503,2020-11-30T14:40:00,2020-12-04T15:13:58,ondernemer,adyen,Zo zorg je online voor minder verlaten winkelwagentjes
504,2020-11-23T17:25:00,2020-12-04T15:21:03,ondernemer,adyen,Een goede online shopervaring begint bij de afrekenpagina
505,2020-11-20T08:55:00,2021-01-06T13:00:36,ondernemer,adyen,Zo zorg je voor loyale klanten on- en offline
506,2021-02-02T08:50:00,2021-02-02T09:19:09,ondernemer,kamer-van-koophandel,Rotterdams bedrijf Somnox verovert de wereld met robot die slaapproblemen oplost
507,2020-09-01T06:00:00,2020-08-31T15:23:39,ondernemer,kamer-van-koophandel,De Tovertafel flexibiliteit en innovatie: zo verovert Active Cues de wereld
508,2020-09-01T06:00:00,2020-08-31T15:23:57,ondernemer,kamer-van-koophandel,Succesvol ondernemen volgens Yoni? Heb lef maar vooral: sta achter je missie
509,2020-08-12T15:48:00,2020-10-15T12:34:32,ondernemer,kamer-van-koophandel,Innoveren voor een duurzame toekomst: ondernemers KVK Innovatie Top 100 vertellen
510,2020-08-06T12:35:00,2020-10-07T14:46:07,ondernemer,kamer-van-koophandel,Positieve cijfers KVK: groeitrend zzp'ers herstelt (en toename kapsalons)
511,2020-01-23T15:32:00,2020-10-07T14:20:57,ondernemer,kamer-van-koophandel,KVK Innovatie Top 100: welke mkb-bedrijven maken kans?
512,2020-01-09T10:42:00,2020-10-07T14:50:50,ondernemer,kamer-van-koophandel,Directeur KvK: 'Groei van zzp naar mkb is misschien niet meer van deze tijd'
513,2019-12-19T16:00:00,2020-10-07T14:16:00,ondernemer,kamer-van-koophandel,Claudia Zuiderwijk: 'KVK Adviesteam biedt laagdrempelig praktische content'
514,2019-12-05T09:00:00,2020-10-07T14:16:14,ondernemer,kamer-van-koophandel,Advies en ambitie: zo bouw je een succesmerk
515,2019-11-28T13:54:00,2019-12-06T10:33:57,ondernemer,kamer-van-koophandel,Het KVK Adviesteam staat klaar voor elke ondernemersvraag
516,2019-10-12T10:30:00,2020-10-07T14:23:59,ondernemer,kamer-van-koophandel,7 op 10 bedrijven niet tevreden over eigen prestaties innovatie
517,2019-10-01T13:36:00,2020-10-07T14:20:38,ondernemer,kamer-van-koophandel,Physee als winnaar KvK Innovatie Top 100 te gast bij De Ondernemer
518,2019-09-25T17:16:00,2020-10-07T14:20:07,ondernemer,kamer-van-koophandel,Physee wint KvK Innovatie Top 100
519,2019-08-19T11:10:00,2020-10-07T14:16:30,ondernemer,kamer-van-koophandel,Nieuw adviesnummer van de KVK moet helpen bij ondernemerskwesties
520,2019-02-22T08:00:00,2020-10-07T14:35:18,ondernemer,kamer-van-koophandel,KVK-Financieringsdesk ondersteunt bedrijven op weg naar levensvatbaarheid
521,2019-01-02T11:02:00,2020-10-07T14:48:05,ondernemer,kamer-van-koophandel,Aantal KvK-inschrijvingen door bedrijvige tieners met 31 procent toegenomen
522,2018-03-28T14:00:00,2020-10-07T14:13:54,ondernemer,kamer-van-koophandel,Met deze financieringsvormen kom je aan extra geld voor je bedrijf
523,2020-10-15T08:59:00,2020-10-15T12:51:51,ondernemer,salesforce,Zo hielp slimme technologie Picnic de crisisdrukte door
524,2020-10-14T10:54:00,2020-10-16T12:32:11,ondernemer,salesforce,Dit leerden we van Salesforce Live: Benelux
525,2020-09-30T12:46:00,2020-10-07T16:53:35,ondernemer,salesforce,Salesforce organiseert digitaal live event met klanten cases en industrie specifieke content
526,2020-09-30T12:24:00,2020-10-14T14:10:40,ondernemer,salesforce,Slim datagedreven groeien: Het succesverhaal van Just Eat Takeaway
527,2020-09-29T16:13:00,2020-10-07T16:49:59,ondernemer,salesforce,Zo gaat Picnic om met snelle groei in coronatijd
528,2020-09-17T08:21:00,2020-10-07T16:47:15,ondernemer,salesforce,Zo word je beter in digitaal ondernemen
529,2020-09-08T15:40:00,2020-10-01T15:34:56,ondernemer,salesforce,Waarom deze IT-architect zo blij is met de voltooide digitaliseringsslag
530,2020-09-08T15:06:00,2020-10-01T15:33:54,ondernemer,salesforce,Zo kan deze leverancier van bakbenodigdheden 'nog 100 jaar bestaan’
531,2020-09-02T14:49:00,2020-10-01T15:27:07,ondernemer,salesforce,Hoe een medisch leverancier mondkapjes kon blijven verstrekken tijdens de lockdown
532,2020-09-02T13:55:00,2020-10-01T15:26:33,ondernemer,salesforce,Waterleverancier kwam coronacrisis door en kon water blijven leveren dankzij nieuw platform
533,2020-08-13T14:17:00,2020-10-01T15:27:23,ondernemer,salesforce,‘Begin gewoon en maak het systeem steeds beter’
534,2020-08-13T14:17:00,2020-10-01T15:25:50,ondernemer,salesforce,‘Klanten eisen meer flexibiliteit zoals bij Netflix’
535,2019-12-04T09:40:00,2020-10-01T15:12:30,ondernemer,salesforce,Slimme online marketing: het succes van alles in eigen hand houden
536,2019-06-27T11:15:00,2020-10-01T12:13:41,ondernemer,salesforce,Grote zorgen in het mkb: personeel lijdt onder tijdsdruk
537,2019-06-06T09:41:00,2020-10-01T15:28:52,ondernemer,salesforce,Tony’s Chocolonely en Salesforce in top beste Europese werkplekken
538,2019-05-22T14:32:00,2020-10-01T12:32:49,ondernemer,salesforce,Bedrijf dicht loonkloof 125 vrouwen krijgen salarisverhoging
539,2019-05-20T12:00:00,2020-10-01T12:33:59,ondernemer,salesforce,Werkend Nederland steeds positiever over werkgever
540,2019-05-19T14:29:00,2020-10-01T15:27:42,ondernemer,salesforce,Zo zorgt software-gigant Salesforce voor een ‘werkhemel’ voor zijn personeel
541,2019-05-14T21:00:00,2020-10-01T12:16:19,ondernemer,salesforce,Hunkemöller: in tien jaar van retailer naar fashionmerk
542,2019-03-27T09:54:00,2020-10-01T12:35:30,ondernemer,salesforce,Winnaars Best Workplaces zorgen dat mensen de baas zijn over hun werk
543,2019-03-19T16:01:00,2020-10-01T12:12:50,ondernemer,salesforce,De vijf belangrijkste trends in klantenservice
544,2018-09-12T14:53:00,2020-10-01T12:15:12,ondernemer,salesforce,Groeibriljant BALR. met 1.200 influencers naar 100 miljoen omzet
545,2018-01-04T06:00:00,2020-10-01T12:31:55,ondernemer,salesforce,Zo verloopt de dag van Edwin Schaap (Payper)
546,2020-12-28T16:14:00,2020-12-28T16:20:50,ondernemer,uwv,Ruim 23.000 extra aanvragen voor loonsteun door tweede lockdown
547,2020-12-11T14:00:00,2020-12-15T10:55:15,ondernemer,uwv,Installatiebedrijf Tibo-Veen heeft een eigen bedrijfsschool
548,2020-12-11T14:00:00,2020-12-11T15:20:34,ondernemer,uwv,Reorganisatie? Ontslag met wederzijds goedvinden biedt oplossing
549,2020-11-26T08:36:00,2020-12-15T11:00:21,ondernemer,uwv,NOW: de tools tips en tricks
550,2020-04-06T16:31:00,2020-11-10T15:24:05,ondernemer,uwv,35.000 bedrijven vragen bij UWV om tegemoetkoming in loonkosten (NOW)
551,2020-04-06T10:29:00,2020-11-10T15:18:27,ondernemer,uwv,Noodloket voor werkgevers open: UWV verwacht tienduizenden aanmeldingen per dag
552,2018-07-28T09:00:00,2020-11-10T15:23:00,ondernemer,uwv,Zo vind je volgens de UWV-topman geschikt personeel
553,2021-02-10T08:30:00,2021-02-11T10:36:12,ondernemer,t-mobile,Bedrijfsprocessen verbeteren en businessmodellen verzilveren met IoT
554,2021-01-25T09:35:00,2021-01-25T11:47:47,ondernemer,t-mobile,De impact van 5G op de economie én je bedrijf
555,2021-01-08T09:32:00,2021-01-20T09:23:12,ondernemer,t-mobile,Hoe je bedrijf juist nu kan groeien met digitale transformatie
556,2020-12-01T08:23:00,2020-12-04T13:59:46,ondernemer,t-mobile,Ondernemen na corona: lessen van de pandemie volgens futurist Igor Beuker
557,2020-11-09T16:10:00,2020-11-26T13:19:59,ondernemer,t-mobile,Ondernemers koppelen aan corporates: Ewout Karel (Futurelab) over hoe je innovatie versnelt
558,2020-10-01T09:27:00,2020-10-05T11:03:10,ondernemer,t-mobile,Het succesgeheim van GO Sharing scooters en wat je ermee kunt voor je bedrijf
559,2020-09-07T10:00:00,2020-11-04T11:14:30,ondernemer,t-mobile,De klant is ‘digitaler’ én kritischer dan ooit. Dit is het gevolg voor je businessmodel
560,2020-07-08T08:50:00,2020-07-08T08:53:18,ondernemer,t-mobile,Maarten Lens-FitzGerald over hoe je personeel meekrijgt in verandering
561,2019-12-09T11:30:00,2020-01-13T08:52:37,ondernemer,t-mobile,Hoe je inspeelt op de smartphone-obsessie van je klanten én personeel
562,2019-11-18T17:00:00,2019-11-28T13:26:09,ondernemer,t-mobile,Hoe MKB-uitblinker Experius talent bindt met een Chief Happiness Officer
563,2019-10-08T08:40:00,2020-01-27T10:14:31,ondernemer,t-mobile,Deze 3 trends zijn een game changer voor ondernemers
564,2019-07-05T13:11:00,2019-10-16T15:58:17,ondernemer,t-mobile,Zo bouw je aan een optimale cultuur binnen je onderneming
565,2019-06-05T13:46:00,2019-10-16T16:10:56,ondernemer,t-mobile,Zo word je je agenda de baas
566,2019-05-17T07:19:00,2019-10-16T16:14:50,ondernemer,t-mobile,Hoe Stayokay klantcontact verbetert met slimme technologie
567,2019-04-23T15:03:00,2019-10-16T16:13:40,ondernemer,t-mobile,Waarom internetreuzen als Coolblue het mkb kopiëren
568,2019-04-04T15:00:00,2019-10-16T16:15:37,ondernemer,t-mobile,Telefonische acquisitie: hoe je het effectief aanpakt (en hoe absoluut niet)
569,2020-10-13T14:30:00,2020-10-14T13:42:46,ondernemer,visa,Prijswinnaar Van Mourik Sliedrecht maakt de winkel wel heel klantvriendelijk
570,2020-10-13T09:38:00,2020-10-13T14:55:49,ondernemer,visa,Prijswinnaar Lokale Markten brengt de markt online tot leven
571,2020-08-03T06:00:00,2020-08-18T14:19:46,ondernemer,visa,Slim adverteren en communiceren: topdrukte avonturen boerderij De Reuselhoeve
572,2020-08-03T06:00:00,2020-08-18T14:20:43,ondernemer,visa,Corona-hulp kweker: overtollige horeca-oesterzwammen naar consument
573,2020-08-03T06:00:00,2020-08-18T14:21:07,ondernemer,visa,Dit bedrijf lanceert platform voor drive-in festivals op locatie
574,2020-08-03T06:00:00,2020-08-18T12:16:27,ondernemer,visa,Ben jij geniaal lokale ondernemer? Win een online marketing campagne!
575,2021-01-05T10:51:00,2021-02-05T16:25:37,ondernemer,marktlink-fusies-overnames,Corona: 40 procent ondernemers wil bedrijf snel verkopen
576,2020-09-01T16:24:00,2020-10-16T10:41:10,ondernemer,marktlink-fusies-overnames,Snelle groeier OSC stelt niet de klant maar medewerkers centraal
577,2020-09-01T15:31:00,2020-10-16T10:44:46,ondernemer,marktlink-fusies-overnames,'De match is essentieel bij bedrijfsverkoop'
578,2020-09-01T13:49:00,2020-10-16T10:47:41,ondernemer,marktlink-fusies-overnames,Advies bij bedrijfsverkoop: bemoei je vooral niet met je oude bedrijf
579,2020-09-01T13:08:00,2020-10-16T11:00:18,ondernemer,marktlink-fusies-overnames,Covebo voor VNOM de juiste partner in groei
580,2020-09-01T12:00:00,2020-10-16T10:50:02,ondernemer,marktlink-fusies-overnames,Met deze groeistrategie blijft wereldmarktleider Yenlo de concurrentie voor
581,2020-09-01T11:09:00,2020-10-16T10:51:59,ondernemer,marktlink-fusies-overnames,Goede begeleiding zoeken 'essentieel' bij verkoop bedrijf voor Max Blom
582,2020-09-01T10:52:00,2020-10-16T11:05:24,ondernemer,marktlink-fusies-overnames,Het geheim van een overname: de juiste combinatie
583,2020-09-01T10:18:00,2021-01-13T17:12:42,ondernemer,marktlink-fusies-overnames,Deze tips helpen jou aan een legendarisch resultaat van je bedrijfsverkoop
584,2020-09-01T10:17:00,2020-10-16T11:06:35,ondernemer,marktlink-fusies-overnames,Door bedrijfsovername weer tijd voor nieuwe uitdagingen
585,2020-09-01T09:00:00,2020-10-16T11:02:17,ondernemer,marktlink-fusies-overnames,Je bedrijf verkopen aan een investeerder: zo werkt dat
586,2020-09-01T06:00:00,2020-10-16T10:38:12,ondernemer,marktlink-fusies-overnames,Van eigenaar naar accountmanager: waarom Jan Nijland in dienst ging bij zijn eigen bedrijf
587,2020-08-01T13:45:00,2020-10-16T10:36:17,ondernemer,marktlink-fusies-overnames,Pre-exit: verkopen en toch betrokken blijven
588,2020-08-01T09:00:00,2020-10-16T10:59:39,ondernemer,marktlink-fusies-overnames,Is jouw bedrijf klaar voor het boekenonderzoek?
589,2020-08-01T09:00:00,2020-10-16T10:57:03,ondernemer,marktlink-fusies-overnames,Aircovent groeit onder vleugels Wasco verder
590,2020-08-01T09:00:00,2020-10-16T10:54:48,ondernemer,marktlink-fusies-overnames,10 juridische valkuilen bij de verkoop van je bedrijf
591,2020-08-01T09:00:00,2020-10-16T10:52:16,ondernemer,marktlink-fusies-overnames,Hoe beïnvloed ik de waarde van mijn bedrijf?
592,2020-08-01T06:00:00,2020-10-16T11:04:44,ondernemer,marktlink-fusies-overnames,Hoe ga je om met vertrouwelijkheid bij een bedrijfsovername?
593,2020-07-01T09:00:00,2020-10-16T10:49:44,ondernemer,marktlink-fusies-overnames,Wat is het ideale moment om je bedrijf te verkopen?
594,2019-12-12T15:35:00,2020-10-16T11:46:58,ondernemer,marktlink-fusies-overnames,De verkoop van je bedrijf: dit is het traject van koffie tot champagne
595,2017-04-25T09:00:00,2020-10-16T10:40:32,ondernemer,marktlink-fusies-overnames,Succes met kunstgras leidt tot Britse overname
596,2020-06-09T10:00:00,2020-06-11T16:20:01,ondernemer,onvz,Bewegingstips tijdens het thuiswerken
597,2020-01-07T07:00:00,2020-01-06T17:15:29,ondernemer,onvz,2020 is het jaar van de vitale werkvloer
598,2019-12-31T14:52:00,2020-01-02T10:07:55,ondernemer,onvz,Het Vitaalste Bedrijf van Nederland: eervolle vermelding voor chemisch bedrijf Vivochem
599,2019-12-24T14:39:00,2019-12-24T14:41:08,ondernemer,onvz,Zo investeert DPI Consultancy in het energieniveau van medewerkers
600,2019-12-24T14:00:00,2019-12-25T09:06:18,ondernemer,onvz,Xcellent: ‘Vitaliteit zit in het DNA van ons bedrijf’
601,2019-12-24T07:45:00,2019-12-24T07:51:05,ondernemer,onvz,Het Vitaalste Bedrijf van Nederland: Perspectief maakt beter als de beste
602,2019-10-08T13:33:00,2019-10-08T17:02:06,ondernemer,onvz,Dankzij SABIC en een ‘powernap’ worden werknemers nog vitaler
603,2019-08-27T20:30:00,2019-11-26T14:56:58,ondernemer,onvz,Doe de Energy Scan en word 'Het Vitaalste Bedrijf van Nederland'
604,2018-11-19T20:04:00,2019-11-26T15:02:15,ondernemer,onvz,Lightweight Containers uitgeroepen tot Het Vitaalste Bedrijf van Nederland
605,2018-10-22T11:24:00,2019-11-26T15:35:24,ondernemer,onvz,Rexel is Het Vitaalste Bedrijf van Zuid-Holland
606,2018-10-17T15:06:00,2020-01-16T14:54:17,ondernemer,onvz,Connecting Hands is Het Vitaalste Bedrijf van Friesland
607,2018-10-17T12:59:00,2019-11-26T15:43:56,ondernemer,onvz,Lightweight Containers is Het Vitaalste Bedrijf van Noord-Holland
608,2018-10-09T09:12:00,2019-11-26T15:46:11,ondernemer,onvz,Thermae 2000 is Het Vitaalste Bedrijf van Limburg
609,2018-10-06T09:05:00,2019-11-26T15:51:49,ondernemer,onvz,GAC Business Solutions is Het Vitaalste Bedrijf van Noord-Brabant
610,2018-10-02T10:47:00,2019-11-26T15:47:57,ondernemer,onvz,Biohorma is Het Vitaalste Bedrijf van Gelderland
611,2018-10-02T10:40:00,2019-11-26T16:03:30,ondernemer,onvz,Kuipers Logistics is Het Vitaalste Bedrijf van Overijssel
612,2018-09-20T15:33:00,2019-11-26T16:12:25,ondernemer,onvz,Ultraware is Het Vitaalste Bedrijf van Drenthe
613,2018-09-20T15:06:00,2019-11-26T16:13:50,ondernemer,onvz,Voys is Het Vitaalste Bedrijf van Groningen
614,2018-08-28T09:00:00,2019-11-26T16:14:54,ondernemer,onvz,Cultuur als dé manier om nieuw talent te vinden
615,2018-08-14T09:00:00,2019-11-26T16:15:51,ondernemer,onvz,Werken zonder managers? Zo organiseer je dat
616,2018-07-31T13:00:00,2020-01-16T14:56:13,ondernemer,onvz,Bevlogen medewerkers als succesfactor voor je bedrijf
617,2018-05-22T09:00:00,2019-11-26T16:26:38,ondernemer,onvz,Waarom Google een oude caravan gebruikt als vergaderruimte
618,2018-05-01T09:00:00,2019-11-26T16:28:51,ondernemer,onvz,Met deze productiviteitstips bespaart je bedrijf ieder jaar duizenden euro’s
619,2018-04-10T13:07:00,2019-11-26T16:29:07,ondernemer,onvz,Hoe je gelukkige werknemers krijgt door gesprekken te voeren
620,2018-03-28T13:30:00,2019-11-26T16:31:45,ondernemer,onvz,Het Vitaalste Bedrijf van Drenthe 2017: Energiewacht NV
621,2018-03-28T10:30:00,2019-11-26T16:30:21,ondernemer,onvz,Het Vitaalste Bedrijf van Groningen 2017: Avebe
622,2018-03-28T10:10:00,2019-11-26T16:34:36,ondernemer,onvz,Het Vitaalste Bedrijf van Flevoland 2017: Roche Diagnostics
623,2018-03-27T11:21:00,2019-11-26T16:36:44,ondernemer,onvz,Het Vitaalste Bedrijf van Friesland 2017: Wetsus
624,2018-03-27T10:23:00,2019-11-26T16:44:18,ondernemer,onvz,Het Vitaalste Bedrijf van Noord-Holland 2017: WUA
625,2018-03-27T09:58:00,2019-11-26T16:50:46,ondernemer,onvz,Het Vitaalste Bedrijf van Nederland 2017: Jordex Shipping & Forwarding
626,2018-03-27T09:02:00,2019-11-26T16:45:28,ondernemer,onvz,Het Vitaalste Bedrijf van Overijssel 2017: Elementis
627,2018-03-26T12:07:00,2019-11-26T16:53:48,ondernemer,onvz,Het Vitaalste Bedrijf van Utrecht 2017: Xcellent
628,2018-03-26T11:38:00,2019-11-26T16:54:46,ondernemer,onvz,Het Vitaalste Bedrijf van Limburg 2017: Enexis
629,2018-03-25T13:25:00,2019-11-26T17:00:25,ondernemer,onvz,Het Vitaalste Bedrijf van Zeeland 2017: Healthcenter Bodyline
630,2018-03-23T11:57:00,2019-11-26T17:03:26,ondernemer,onvz,Het Vitaalste Bedrijf van Gelderland 2017: Rensa
631,2018-03-07T11:38:00,2019-11-28T08:58:20,ondernemer,onvz,Het Vitaalste Bedrijf van Noord-Brabant 2017: Peijnenburg
632,2017-08-23T06:00:00,2019-11-28T09:04:36,ondernemer,onvz,Vitaliteit is een ongoing proces
633,2017-08-22T10:00:00,2019-11-28T09:17:20,ondernemer,onvz,‘Voelt iedereen zich goed? Dan stralen we dat als organisatie uit’
634,2017-05-24T12:00:00,2019-11-28T09:21:28,ondernemer,onvz,Plekken creëren voor gelukkig personeel
635,2017-05-08T15:32:00,2019-11-28T09:23:13,ondernemer,onvz,Elementis vitaalste bedrijf van Overijssel
636,2017-04-26T00:00:00,2019-11-28T09:23:41,ondernemer,onvz,Vitaliteit op de werkvloer
637,2017-03-31T13:27:00,2019-11-28T10:36:34,ondernemer,onvz,Blije medewerkers zijn duurzaam inzetbaar
638,2017-03-31T13:00:00,2019-11-28T10:37:13,ondernemer,onvz,Positivo’s geven bedrijf nieuwe energie
639,2017-03-17T15:31:00,2019-11-28T10:38:14,ondernemer,onvz,Werknemers gelukkig door traplopen en gezonde lunch
640,2017-03-09T09:00:00,2019-11-28T10:39:37,ondernemer,onvz,Positieve vibe door gezonde medewerker Zalsman
641,2017-03-09T09:00:00,2019-11-28T10:42:15,ondernemer,onvz,Vitaliteit zorgt voor goede werksfeer
642,2019-10-24T15:19:00,2019-10-24T16:24:54,ondernemer,jaarbeurs,Zo groeit de spellenbeurs Spellenspektakel naar 11.000 bezoekers
643,2019-10-24T11:08:00,2019-10-28T14:34:33,ondernemer,jaarbeurs,Heroes Dutch Comic Con succesvol in de Jaarbeurs “We zitten echt nog niet aan onze grenzen”
644,2019-09-30T12:04:00,2019-10-28T14:35:35,ondernemer,jaarbeurs,‘Duurzame innovatieve inhoud laagdrempelig aanbieden – daar gaat het bij deze vakbeurs om’
645,2019-12-03T13:30:00,2019-12-05T14:32:14,ondernemer,new10,De groeisprong: hoe Bob Dijksma (FiscFree) zijn bedrijf redde in crisistijd
646,2019-11-14T13:05:00,2019-11-18T17:00:50,ondernemer,new10,De groeisprong: hoe duurzame pionier OneCircle de gevestigde drankenmarkt opschudt
647,2019-10-29T13:13:00,2019-11-14T10:38:25,ondernemer,new10,De groeisprong: wat je kunt leren van de fouten tijdens het buitenlandavontuur van scale-up Sendcloud
648,2019-10-14T09:07:00,2019-11-21T10:11:17,ondernemer,new10,De groeisprong: hoe Menno Simons structuur aanbracht bij Bocca Coffee en wat je daarvan kunt leren
649,2019-04-18T13:01:00,2019-10-23T11:50:19,ondernemer,new10,Hoe No Nonsense Technical Solutions met extra personeel toewerkt naar omzetverdubbeling
650,2019-03-27T14:39:00,2019-10-23T11:48:33,ondernemer,new10,Hoe Business Models Inc. in één klik een half miljoen regelde
651,2018-12-10T14:31:00,2019-10-23T14:13:33,ondernemer,new10,Het tipping point van Veloretti: hoe je talentvol personeel aantrekt voor internationale groei
652,2018-11-16T13:05:00,2019-10-23T14:14:59,ondernemer,new10,Het tipping point van Sustainder: hoe je pijlsnelle groei naar 500 miljoen in goede banen leidt
653,2018-10-25T10:49:00,2019-10-23T14:16:38,ondernemer,new10,Kas leeg tijdens verbouwing? Zo voorkwam Wicked Grounds vertraging dankzij een online lening
654,2018-10-08T13:06:00,2019-10-23T14:26:52,ondernemer,new10,Met dit simpele systeem werf je 5 keer zoveel klanten
655,2018-09-12T10:11:00,2019-10-23T14:21:18,ondernemer,new10,Het tipping point van Fotodoos: zo doorbreek je een groei-impasse
656,2018-08-17T13:14:00,2019-10-23T14:22:41,ondernemer,new10,Het tipping point van HoneyPie: zo breek je landelijk door
657,2018-07-27T14:41:00,2019-10-23T14:23:23,ondernemer,new10,Het tipping point van YAYA Kombucha: zo bereik je 20 keer meer omzet
658,2019-07-08T14:53:00,2019-10-23T15:07:09,ondernemer,gemeente-enschede,Enschedese ondernemers aan het woord: Emiel Kwekkeboom en Mandy Overbeek van restaurant Joann
659,2019-05-19T10:11:00,2019-10-23T15:07:28,ondernemer,gemeente-enschede,Enschedese ondernemers aan het woord: Martin Schievink van softwarespecialist Akyla
660,2019-04-18T10:25:00,2019-10-23T15:09:25,ondernemer,gemeente-enschede,Enschedese ondernemers aan het woord: Janine Wegman en Barry Harzevoort van Activity International
661,2018-07-25T09:40:00,2019-10-23T15:07:47,ondernemer,gemeente-enschede,Enschedese ondernemers aan het woord: Paulina Kramer van Bed & Breakfast Oekepoek
662,2018-06-19T11:25:00,2019-10-23T15:10:42,ondernemer,gemeente-enschede,Enschedese ondernemers aan het woord: Maarten ten Voorde van Guts & Gusto
663,2018-04-30T14:30:00,2019-10-23T15:15:16,ondernemer,gemeente-enschede,Enschedese ondernemers aan het woord: Lotta Imeyer van ETN Saladebar
664,2018-01-25T09:32:00,2019-10-23T15:15:57,ondernemer,gemeente-enschede,Enschedese ondernemers aan het woord: mode- en textielontwerpster Hellen van Rees
665,2017-11-19T12:00:00,2019-10-23T15:16:26,ondernemer,gemeente-enschede,Enschedese ondernemers aan het woord: Giels Brouwer van SciSports
666,2017-10-23T15:21:00,2019-10-23T15:17:00,ondernemer,gemeente-enschede,Enschedese ondernemers aan het woord: Rocco Chin van craft beer store Stanislaus Brewskovitch
667,2017-09-20T12:01:00,2019-10-23T15:18:51,ondernemer,gemeente-enschede,Enschedese ondernemers aan het woord: herenmodewinkel State of Art
668,2017-08-22T13:26:00,2019-10-23T15:19:35,ondernemer,gemeente-enschede,Enschedese ondernemers aan het woord: Biomass Technology Group
669,2017-03-23T09:09:00,2019-10-23T15:22:15,ondernemer,gemeente-enschede,Enschedese ondernemers aan het woord: NDIX
670,2017-02-09T13:50:00,2019-10-23T15:20:18,ondernemer,gemeente-enschede,Enschedese ondernemers aan het woord: Logic4
671,2016-11-29T15:20:00,2019-10-23T15:23:01,ondernemer,gemeente-enschede,Enschedese ondernemers aan het woord: InterCityHotel
672,2016-10-27T13:41:00,2019-10-23T16:02:49,ondernemer,gemeente-enschede,Enschedese ondernemers aan het woord: GoalGorilla
673,2016-09-27T11:17:00,2019-10-23T15:45:52,ondernemer,gemeente-enschede,Enschedese ondernemers aan het woord: DEMCON
674,2016-08-31T11:47:00,2019-10-23T16:03:26,ondernemer,gemeente-enschede,Enschedese ondernemers aan het woord: RESIN
675,2019-01-31T13:27:00,2019-10-23T16:13:16,ondernemer,hyundai,RDW-directeur rijdt Hyundai op waterstof: ‘Een mooie volgende stap’
676,2018-11-28T09:26:00,2019-10-23T16:13:37,ondernemer,hyundai,Waarom dit Haagse tankstation waterstof omarmt
677,2018-11-20T10:15:00,2019-10-23T16:14:38,ondernemer,hyundai,Hyundai: ‘Ondernemers kunnen waterstofauto’s succesvol maken’
