index,date_published,date_modified,source,sponsor,title
0,2020-08-28T09:16:47,2020-08-28T09:16:47,nrc,KPN,Taalvaardigheid zegt niks over je intelligentie
1,2020-08-07T09:07:57,2020-08-07T09:07:57,nrc,KPN,Het werd vanzelfsprekend om dagelijks te lezen hoe lelijk ik wel niet ben
2,2020-07-24T09:39:56,2020-07-24T09:39:56,nrc,KPN,Uit de kast komen als profvoetballer
3,2020-07-10T06:00:21,2020-07-10T06:00:21,nrc,KPN,Aan de vuile vaat kon ik zien of ik al gegeten had of niet
4,2020-06-24T17:20:34,2020-06-24T17:20:34,nrc,KPN,Als ik terugkijk heb ik me veel alleen gevoeld
5,2020-06-02T08:59:22,2020-06-02T08:59:22,nrc,KPN,Met mensen die dicht bij mij staan praat ik wel over mijn single-zijn
6,2020-06-02T08:59:10,2020-06-02T08:59:10,nrc,KPN,Ik had het gevoel dat ik niet openlijk over mijn burn-out kon spreken
7,2020-05-22T07:02:34,2020-05-22T07:02:34,nrc,KPN,Anorexia beheerste mijn leven
8,2020-11-05T13:38:07,2020-11-05T13:38:07,nrc,Vattenfall,Zo heeft de jeugd de (fossielvrije) toekomst
9,2020-10-07T12:40:47,2020-10-07T12:40:47,nrc,Vattenfall,Groen gas heeft toekomst
10,2020-09-14T07:52:04,2020-09-14T07:52:04,nrc,Vattenfall,Klimaatverandering: kun jij er wat aan doen?
11,2020-07-09T11:53:26,2020-07-09T11:53:26,nrc,Vattenfall,Een fossielvrije samenleving: is dat mogelijk?
12,2020-06-09T11:53:26,2020-06-09T11:53:26,nrc,Vattenfall,Zoek de zon op
13,2020-05-11T10:02:23,2020-05-11T10:02:23,nrc,Vattenfall,Het verhaal achter de energierekening
14,2020-04-14T11:01:43,2020-04-14T11:01:43,nrc,Vattenfall,Samen (veilig) bouwen aan de energietransitie
15,2019-11-05T12:46:58,2019-11-05T12:46:58,nrc,Vattenfall,Waarom warmtenetten de toekomst hebben
16,2019-10-10T13:53:06,2019-10-10T13:53:06,nrc,Vattenfall,Een windpark bouwen ook bij tegenwind
17,2019-10-09T08:34:54,2019-10-09T08:34:54,nrc,Vattenfall,Achter de schermen bij nieuwe Noordzee-windparken
18,2019-10-08T12:33:55,2019-10-08T12:33:55,nrc,Vattenfall,Dit moet je weten over warmtepompen
19,2019-10-07T12:01:02,2019-10-07T12:01:02,nrc,Vattenfall,Onderzoek: breed draagvlak voor aardgasvrije warmte
20,2019-09-04T09:29:23,2019-09-04T09:29:23,nrc,Vattenfall,Waarom stroomopslag steeds belangrijker wordt
21,2019-08-16T12:30:32,2019-08-16T12:30:32,nrc,Vattenfall,Zonnepanelen: juist nu een goede keuze
22,2019-07-09T12:31:50,2019-07-09T12:31:50,nrc,Vattenfall,Rijdt iedereen straks elektrisch?
23,2018-11-08T14:31:35,2018-11-08T14:31:35,nrc,Vattenfall,Zo ingrijpend verandert de energietransitie ons leven
24,2018-09-10T08:45:42,2018-09-10T08:45:42,nrc,Vattenfall,Altijd en overal duurzame energie
25,2018-07-23T13:34:48,2018-07-23T13:34:48,nrc,Vattenfall,Hoog rendement op verduurzamen van je huis
26,2018-06-28T11:23:00,2018-06-28T11:23:00,nrc,Vattenfall,Energiebesparing telt voor drie
27,2018-06-06T08:57:57,2018-06-06T08:57:57,nrc,Vattenfall,Deze impact hebben windparken op de zee
28,2018-05-08T18:29:33,2018-05-08T18:29:33,nrc,Vattenfall,Grote milieuwinst te halen bij verduurzamen dataverkeer
29,2018-04-05T09:13:17,2018-04-05T09:13:17,nrc,Vattenfall,Van afval naar duurzame warmte
30,2018-02-07T12:22:06,2018-02-07T12:22:06,nrc,Vattenfall,Elektrisch rijden: meer dan milieuwinst?
31,2018-01-12T14:32:37,2018-01-12T14:32:37,nrc,Vattenfall,Een groene toekomst: zijn we goed op weg?
32,2017-08-10T14:59:50,2017-08-10T14:59:50,nrc,Vattenfall,De energiecentrale van de toekomst
33,2017-08-07T08:26:28,2017-08-07T08:26:28,nrc,Vattenfall,Hoe lang rijdt een zonneauto zonder tanken?
34,2017-07-17T08:09:33,2017-07-17T08:09:33,nrc,Vattenfall,Zo wordt het water weer gezond (en blijven gebouwen koel)
35,2017-06-12T09:19:06,2017-06-12T09:19:06,nrc,Vattenfall,Hoe groen is groene stroom eigenlijk?
36,2017-05-12T14:22:46,2017-05-12T14:22:46,nrc,Vattenfall,Hoe windenergie steeds goedkoper kan worden
37,2018-02-22T15:43:09,2018-02-22T15:43:09,nrc,Thinketfs,De identiteitscrisis van de sparende Nederlander
38,2018-02-08T14:18:31,2018-02-08T14:18:31,nrc,Thinketfs,Passief beleggen: Ik hoef niet constant zenuwachtig naar de koersen te kijken
39,2018-02-01T15:55:29,2018-02-01T15:55:29,nrc,Thinketfs,De psychologie van beleggen: lessen van een Nobelprijswinnaar
40,2018-01-25T14:30:37,2018-01-25T14:30:37,nrc,Thinketfs,Slim beleggen? Beperk je risico!
41,2020-12-08T11:06:26,2020-12-08T11:06:26,nrc,ONVZ,Negatieve calorieen zo zit dat
42,2020-12-08T11:05:04,2020-12-08T11:05:04,nrc,ONVZ,Bent u een slimmerik?
43,2020-12-08T11:04:56,2020-12-08T11:04:56,nrc,ONVZ,Wat eten we in de toekomst?
44,2020-12-08T11:04:47,2020-12-08T11:04:47,nrc,ONVZ,De waarheid over water
45,2020-09-18T13:00:50,2020-09-18T13:00:50,nrc,ONVZ,Bestaat het ultieme dieet
46,2020-09-18T13:00:16,2020-09-18T13:00:16,nrc,ONVZ,Een gezond gevoel door humor
47,2020-09-18T13:00:10,2020-09-18T13:00:10,nrc,ONVZ,Knippen en plakken met gewassen
48,2020-07-08T08:30:31,2020-07-08T08:30:31,nrc,ONVZ,Podcast: Menselijk reukvermogen wordt onderschat
49,2020-06-26T07:23:41,2020-06-26T07:23:41,nrc,ONVZ,Podcast: Te veel vet is niet (altijd) ongezond
50,2020-06-24T17:21:36,2020-06-24T17:21:36,nrc,ONVZ,Podcast: Houd je hart gezond
51,2020-06-12T13:00:51,2020-06-12T13:00:51,nrc,ONVZ,Bewegen voor je bovenkamer
52,2020-06-12T13:00:43,2020-06-12T13:00:43,nrc,ONVZ,De zin en onzin van vitaminepillen
53,2020-06-12T13:00:23,2020-06-12T13:00:23,nrc,ONVZ,Daar hebben we een neus voor
54,2020-04-06T10:01:49,2020-04-06T10:01:49,nrc,ONVZ,Leve de gezonde leefstijl
55,2020-04-06T09:46:46,2020-04-06T09:46:46,nrc,ONVZ,Word je dik van brood?
56,2020-04-06T09:25:34,2020-04-06T09:25:34,nrc,ONVZ,De rol van vet
57,2019-12-06T16:30:27,2019-12-06T16:30:27,nrc,ONVZ,Een algoritme geeft voedingsadvies
58,2019-12-06T16:28:34,2019-12-06T16:28:34,nrc,ONVZ,De impact van geluid
59,2019-12-06T16:16:33,2019-12-06T16:16:33,nrc,ONVZ,Rimpels en krimpende botten
60,2019-12-06T16:00:13,2019-12-06T16:00:13,nrc,ONVZ,Eenzaam of te weinig alleen
61,2019-09-19T22:35:15,2019-09-19T22:35:15,nrc,ONVZ,Sportvoeding: junkfood of noodzaak?
62,2019-09-19T22:30:23,2019-09-19T22:30:23,nrc,ONVZ,Een hart zo groot als een speldenknop
63,2019-09-19T22:30:06,2019-09-19T22:30:06,nrc,ONVZ,Een kijkje in het puberbrein
64,2019-09-19T22:20:17,2019-09-19T22:20:17,nrc,ONVZ,Geneest gember?
65,2019-09-19T22:10:12,2019-09-19T22:10:12,nrc,ONVZ,Zin in geluk
66,2019-09-19T22:01:10,2019-09-19T22:01:10,nrc,ONVZ,Wees wijs met voedsel
67,2019-06-14T22:15:57,2019-06-14T22:15:57,nrc,ONVZ,Zeewier als duurzame (voedsel)bron
68,2019-06-14T22:15:38,2019-06-14T22:15:38,nrc,ONVZ,Hou van je hart
69,2019-06-14T22:15:06,2019-06-14T22:15:06,nrc,ONVZ,Waarom lijkt het gras bij de buren groener?
70,2020-12-15T15:51:59,2020-12-15T15:51:59,nrc,TNO,De effecten van microplastics vragen om een wereld aan onderzoek
71,2020-12-15T15:51:51,2020-12-15T15:51:51,nrc,TNO,De waardeketen moet helemaal aan elkaar geknoopt worden
72,2020-12-01T08:02:15,2020-12-01T08:02:15,nrc,TNO,Dat verpakkingen uit meerdere lagen bestaan kun je als consument niet zien
73,2020-12-01T08:01:54,2020-12-01T08:01:54,nrc,TNO,Een slim ontwerp geeft waardevolle grondstoffen terug
74,2019-04-26T22:01:28,2019-04-26T22:01:28,nrc,TNO,Grote winstkansen met gebruik industriele restwarmte
75,2019-04-12T22:01:11,2019-04-12T22:01:11,nrc,TNO,We moeten naar negatieve CO2-emissie
76,2019-03-29T23:01:45,2019-03-29T23:01:45,nrc,TNO,CO2-reductie: industrie moet efficienter werken
77,2019-03-15T23:01:30,2019-03-15T23:01:30,nrc,TNO,Versnellen energietransitie noodzaak en kans voor industrie
78,2018-12-12T13:15:28,2018-12-12T13:15:28,nrc,TNO,Nederland dreigt achterop te raken met  AI
79,2018-12-03T10:22:33,2018-12-03T10:22:33,nrc,TNO,Hoe Big Data kan leiden tot betere gezondheidszorg
80,2018-11-28T09:21:21,2018-11-28T09:21:21,nrc,TNO,Lastige ethische en legale vragen bij kunstmatige intelligentie
81,2020-12-18T13:00:53,2020-12-18T13:00:53,nrc,Roche,De hele zorgketen begint bij een goed gesprek
82,2020-12-18T13:00:49,2020-12-18T13:00:49,nrc,Roche,Uitgestelde zorg betekent minder grip op eigen regie
83,2020-12-18T13:00:48,2020-12-18T13:00:48,nrc,Roche,Een leven lang regie houden is belangrijk
84,2020-12-18T13:00:32,2020-12-18T13:00:32,nrc,Roche,e-Health helpt zorgverleners en patient
85,2020-12-18T13:00:28,2020-12-18T13:00:28,nrc,Roche,Het belang van de patient verbindt ons
86,2020-12-18T13:00:21,2020-12-18T13:00:21,nrc,Roche,Een doorbraak  is mogelijk
87,2020-12-18T13:00:14,2020-12-18T13:00:14,nrc,Roche,Dit kan het leven van de patient dragelijker maken
88,2020-09-25T13:00:43,2020-09-25T13:00:43,nrc,Roche,Samen voor een gezonde toekomst
89,2020-09-25T13:00:42,2020-09-25T13:00:42,nrc,Roche,Ik ervaar het als heel prettig en vertrouwd
90,2020-09-25T13:00:40,2020-09-25T13:00:40,nrc,Roche,Samen werken aan een betrouwbare coronatest
91,2020-09-25T13:00:25,2020-09-25T13:00:25,nrc,Roche,Bedrijfsleven en zorgpartijen moeten nauw samenwerken
92,2020-09-25T13:00:25,2020-09-25T13:00:25,nrc,Roche,Toplaboratorium werkt t liefst  in stilte
93,2020-09-25T13:00:24,2020-09-25T13:00:24,nrc,Roche,Samenwerking:  slaap- of pepmiddel?
94,2020-09-25T13:00:14,2020-09-25T13:00:14,nrc,Roche,Big data verbindt artsen en farmacie
95,2020-06-19T13:00:57,2020-06-19T13:00:57,nrc,Roche,Crises jagen innovatie aan
96,2020-06-19T13:00:42,2020-06-19T13:00:42,nrc,Roche,Zorgdata zijn cruciaal bij de aanpak van corona
97,2020-06-19T13:00:37,2020-06-19T13:00:37,nrc,Roche,De juiste mensen samenbrengen tegen kanker
98,2020-06-19T13:00:26,2020-06-19T13:00:26,nrc,Roche,Vertrouwen op creativiteit
99,2020-06-19T13:00:21,2020-06-19T13:00:21,nrc,Roche,Zo kan elke patient de aandacht en expertise ontvangen die nodig zijn
100,2020-06-19T13:00:19,2020-06-19T13:00:19,nrc,Roche,AMR:  de onstuitbare sluipmoordenaar
101,2020-03-27T23:00:52,2020-03-27T23:00:52,nrc,Roche,Big data: katalysator van betere zorg
102,2020-03-27T23:00:39,2020-03-27T23:00:39,nrc,Roche,Een farmacogenetisch paspoort is voor vrijwel iedereen gunstig
103,2020-03-27T23:00:28,2020-03-27T23:00:28,nrc,Roche,Samen doorpakken kan leiden tot een forse ziektelastdaling
104,2020-03-27T23:00:07,2020-03-27T23:00:07,nrc,Roche,Ik was liever direct met de juiste medicatie gestart
105,2020-03-27T23:00:05,2020-03-27T23:00:05,nrc,Roche,Kunstmatige intelligentie: de buddy van de specialist
106,2020-03-27T23:00:00,2020-03-27T23:00:00,nrc,Roche,De uitdaging: technologie persoonlijk maken
107,2019-11-22T08:30:35,2019-11-22T08:30:35,nrc,Roche,Ik ben alweer vier jaar pillenvrij
108,2019-11-22T08:21:14,2019-11-22T08:21:14,nrc,Roche,De vele gezichten van preventie
109,2019-11-22T08:15:15,2019-11-22T08:15:15,nrc,Roche,Ik had het gevoel zelf bij te dragen aan mijn herstel
110,2020-09-17T07:34:39,2020-09-17T07:34:39,nrc,Shell,Snelladen bij Shell: Bij ons kun je ook jezelf opladen
111,2019-12-20T14:15:55,2019-12-20T14:15:55,nrc,Shell,Podcast: Bos dat we nu aanplanten moet driehonderd jaar mee kunnen
112,2019-09-27T14:57:33,2019-09-27T14:57:33,nrc,Shell,Zichtbaar duurzaam gedrag motiveert anderen
113,2019-06-28T22:01:10,2019-06-28T22:01:10,nrc,Shell,Podcast: CO2-compensatie is reductie maar dan op een andere plek
114,2019-05-10T09:23:55,2019-05-10T09:23:55,nrc,Shell,Efficienter rijden is per definitie goedkoper rijden
115,2019-04-18T14:12:11,2019-04-18T14:12:11,nrc,Shell,In Noorwegen ontstond een run op elektrische autos
116,2019-04-10T09:51:56,2019-04-10T09:51:56,nrc,Shell,Ruim 80% van de essen in Nederland is momenteel aangetast
117,2019-01-24T10:30:11,2019-01-24T10:30:11,nrc,Shell,Brandstofkeuze hangt af van waar je woont
118,2019-01-16T14:02:41,2019-01-16T14:02:41,nrc,Shell,We hebben veel meer energie nodig maar wel schone
119,2019-01-16T14:01:10,2019-01-16T14:01:10,nrc,Shell,De voordelen van waterstof
120,2019-01-16T14:00:34,2019-01-16T14:00:34,nrc,Shell,Waterstof kan alles
121,2019-01-16T13:58:15,2019-01-16T13:58:15,nrc,Shell,Wij leiden mensen op die de energietransitie gaan versnellen
122,2018-12-14T15:00:20,2018-12-14T15:00:20,nrc,Shell,Zo wordt synthetische brandstof gemaakt
123,2018-12-12T11:11:46,2018-12-12T11:11:46,nrc,Shell,Als het lukt CO2 om te zetten in brandstof sluiten we de cirkel
124,2018-12-12T11:11:26,2018-12-12T11:11:26,nrc,Shell,De energiesector is risicomijdend en traag met veranderen
125,2018-12-12T11:11:00,2018-12-12T11:11:00,nrc,Shell,De energietransitie is de nieuwe industriele revolutie
126,2018-11-12T11:09:32,2018-11-12T11:09:32,nrc,Shell,Synthetische kerosine is de enige oplossing
127,2018-11-12T11:09:03,2018-11-12T11:09:03,nrc,Shell,Er moet een deltaplan voor de energietransitie komen
128,2018-11-12T11:08:44,2018-11-12T11:08:44,nrc,Shell,Nu rijden we op benzine of diesel. Straks met accus of waterstof
129,2018-01-17T09:29:11,2018-01-17T09:29:11,nrc,Shell,Energieneutraal wonen? Het kan echt!
130,2018-01-17T09:27:35,2018-01-17T09:27:35,nrc,Shell,Restwarmte: in 5 stappen van raffinaderij naar radiator
131,2018-01-03T14:07:22,2018-01-03T14:07:22,nrc,Shell,Relaxter rijden dankzij een stille auto
132,2018-01-03T14:05:07,2018-01-03T14:05:07,nrc,Shell,Laat maar waaien: 9 dingen die je nog niet wist over windenergie
133,2018-01-03T14:01:25,2018-01-03T14:01:25,nrc,Shell,Over batterijen die veel langer meegaan. En hoe dat kan
134,2019-06-21T15:00:41,2019-06-21T15:00:41,nrc,interpolis,Hoe ga je om met uitval van medewerkers in een familiebedrijf?
135,2019-06-14T14:00:30,2019-06-14T14:00:30,nrc,interpolis,Ziekteverzuim vraagt om bewustwording bij ondernemers
136,2019-05-10T07:53:09,2019-05-10T07:53:09,nrc,interpolis,Verzekeraar werkt als wekker bij ziekteverzuim
137,2019-05-03T13:07:10,2019-05-03T13:07:10,nrc,interpolis,Ik wil in de top vijf van foodservicebakkers blijven
138,2019-04-26T13:17:20,2019-04-26T13:17:20,nrc,interpolis,Onderzoek: veranderende regels grootste zorg voor ondernemers
139,2019-11-22T13:03:34,2019-11-22T13:03:34,nrc,Huawei,Kinderen worden niet geboren als digital natives
140,2019-11-22T13:03:21,2019-11-22T13:03:21,nrc,Huawei,Zonnepanelen op het water. Wordt Nederland koploper?
141,2019-11-15T12:33:56,2019-11-15T12:33:56,nrc,Huawei,Onze ontwikkelingen zullen gepaard gaan met ongewenste nevenactiviteiten
142,2019-11-15T12:33:49,2019-11-15T12:33:49,nrc,Huawei,Hoe lees je een slechthorend kind voor?
143,2019-06-10T10:00:39,2019-06-10T10:00:39,nrc,Volvo,Slimme autos: wie is de baas jij of de techniek?
144,2019-06-10T08:05:23,2019-06-10T08:05:23,nrc,Volvo,Volvo deelt data veiligheid met concurrentie
145,2019-06-10T08:00:00,2019-06-10T08:00:00,nrc,Volvo,Nieuwe eisen aan veiligheid autos in 2022
146,2019-06-06T07:59:51,2019-06-06T07:59:51,nrc,Volvo,Volvo begrenst maximumsnelheid autos tot 180
147,2019-06-04T09:26:56,2019-06-04T09:26:56,nrc,Volvo,Slimme auto anticipeert op onveilige situaties
148,2019-05-27T10:00:39,2019-05-27T10:00:39,nrc,Volvo,Binnen paar jaar zelfrijdende autos op snelweg
149,2018-07-09T08:03:37,2018-07-09T08:03:37,nrc,Volvo,Vergeet wat je weet over autos; dit wordt de toekomst
150,2018-07-09T08:02:49,2018-07-09T08:02:49,nrc,Volvo,Wat auto-ontwerpers leren van je kinderen
151,2018-06-07T11:06:44,2018-06-07T11:06:44,nrc,Volvo,Pakketje? Laat m bezorgen in je auto
152,2018-06-06T09:41:34,2018-06-06T09:41:34,nrc,Volvo,Nieuwste autos helpen menselijk falen te verminderen
153,2017-12-21T09:25:10,2017-12-21T09:25:10,nrc,Volvo,Het geheim van Hallered
154,2017-12-14T10:19:34,2017-12-14T10:19:34,nrc,Volvo,Voor iedereen een elektrische auto
155,2017-12-07T08:36:10,2017-12-07T08:36:10,nrc,Volvo,Wordt de bestuurder de passagier?
156,2017-11-23T09:00:48,2017-11-23T09:00:48,nrc,Volvo,Vanaf 2020 geen dodelijke ongelukken meer in een Volvo
157,2017-11-17T08:43:39,2017-11-17T08:43:39,nrc,Volvo,Nooit meer een rommelige auto
158,2017-11-01T10:58:13,2017-11-01T10:58:13,nrc,Volvo,Volvos visie op veiligheid
159,2017-11-01T10:57:59,2017-11-01T10:57:59,nrc,Volvo,Van idee tot een nieuwe Volvo in 36 maanden
160,2017-11-01T10:57:42,2017-11-01T10:57:42,nrc,Volvo,De toekomst is elektrisch
161,2018-05-25T13:01:10,2018-05-25T13:01:10,nrc,Deloitte,Hoe bankieren we over tien jaar? Niet meer zoals nu misschien
162,2018-04-26T07:29:37,2018-04-26T07:29:37,nrc,Deloitte,Vaccinatieboekje voortaan in de blockchain?
163,2018-04-26T07:29:30,2018-04-26T07:29:30,nrc,Deloitte,Zestienjarige hackt op verzoek zijn eigen school
164,2018-04-20T11:49:04,2018-04-20T11:49:04,nrc,Deloitte,Volwassenen steeds meer bereid om te betalen voor digitale content
165,2018-04-05T07:19:24,2018-04-05T07:19:24,nrc,Deloitte,Hoeveel zonnepanelen kunnen op onze daken?
166,2018-03-30T09:47:03,2018-03-30T09:47:03,nrc,Deloitte,Zo word je een kampioen in hacken
167,2018-03-16T08:19:33,2018-03-16T08:19:33,nrc,Deloitte,Een 10-jarige met een eigen pinpas: gaat dat wel goed?
168,2018-03-14T10:02:00,2018-03-14T10:02:00,nrc,Deloitte,Je brein voorspelt je baankans
169,2018-03-14T10:01:18,2018-03-14T10:01:18,nrc,Deloitte,Nederlanders zijn dol op digitaal experimenteren
170,2018-02-15T13:00:17,2018-02-15T13:00:17,nrc,Deloitte,Wil je een baan? Ga in de cybersecurity!
171,2018-01-22T14:45:04,2018-01-22T14:45:04,nrc,Deloitte,Van A naar B reizen wordt net zo makkelijk als Netflixen
172,2018-01-05T14:13:31,2018-01-05T14:13:31,nrc,Deloitte,Speelgoed wordt steeds slimmer. Maar hoe veilig is dat?
173,2017-12-21T09:38:33,2017-12-21T09:38:33,nrc,Deloitte,Steeds meer hengelaars vissen naar jouw geld
174,2017-12-11T16:56:58,2017-12-11T16:56:58,nrc,Deloitte,Worden verzekeringen steeds minder saai?
175,2017-11-23T15:47:35,2017-11-23T15:47:35,nrc,Deloitte,Moet je nou wel of niet je wachtwoord veranderen?
176,2017-10-19T14:36:39,2017-10-19T14:36:39,nrc,Deloitte,Hoe je met data een wedstrijd kunt winnen
177,2017-10-05T14:46:27,2017-10-05T14:46:27,nrc,Deloitte,Podcast: Zo creeer je een eigen digitaal DNA
178,2017-06-19T08:50:23,2017-06-19T08:50:23,nrc,Deloitte,We gaan in een speedboot op een ijsberg af
179,2017-06-15T11:10:13,2017-06-15T11:10:13,nrc,Deloitte,De klant als ontwikkelaar van de nieuwe mobiliteit
180,2017-06-13T08:29:38,2017-06-13T08:29:38,nrc,Deloitte,De stadsbus wordt straks niet meer gemist
181,2017-06-07T14:47:21,2017-06-07T14:47:21,nrc,Deloitte,Je auto is gehackt ga direct naar de kant!
182,2017-05-23T11:13:07,2017-05-23T11:13:07,nrc,Deloitte,Hoe we weer de baas worden over onze eigen data
183,2017-05-12T10:16:02,2017-05-12T10:16:02,nrc,Deloitte,Een huis-tuin-en-keukenrobot maak je zo!
184,2017-05-08T08:51:02,2017-05-08T08:51:02,nrc,Deloitte,Hoe bereik je zakelijk succes in dit digitale decennium? Zo dus!
185,2017-05-04T09:03:27,2017-05-04T09:03:27,nrc,Deloitte,Wie is sneller de robot of de mens?
186,2017-04-24T14:59:23,2017-04-24T14:59:23,nrc,Deloitte,Alles wat je wilt weten over kunstmatige intelligentie
187,2017-04-12T14:54:35,2017-04-12T14:54:35,nrc,Deloitte,Innoveren in vijf lessen
188,2017-04-06T07:41:08,2017-04-06T07:41:08,nrc,Deloitte,Innoveren is meer dan het verzamelen van een berg goede ideeen
189,2017-03-30T08:05:15,2017-03-30T08:05:15,nrc,Deloitte,PETER HINSSEN: Wil je als bedrijf overleven dan is doen wat je al doet niet de juiste strategie
190,2020-05-15T08:30:52,2020-05-15T08:30:52,nrc,Vodafone,80 procent van de projecttijd besteedden we aan adoptie
191,2019-11-25T09:19:07,2019-11-25T09:19:07,nrc,Vodafone,Een internationaal merk creeren dat is het doel
192,2019-11-25T09:18:57,2019-11-25T09:18:57,nrc,Vodafone,IoT bleek een game-changer voor autobeveiliging
193,2019-11-25T09:18:34,2019-11-25T09:18:34,nrc,Vodafone,Met Smarter Working maak je jezelf aantrekkelijker als werkgever
194,2019-10-24T09:02:01,2019-10-24T09:02:01,nrc,Vodafone,IoT levert vaak ook verbetering van bedrijfsprocessen op
195,2019-09-20T14:40:17,2019-09-20T14:40:17,nrc,Vodafone,&bdquo;Connectiviteit heeft de toekomst&rdquo;
196,2019-09-16T09:59:38,2019-09-16T09:59:38,nrc,Vodafone,Ons doel? Persoonlijk en snel samenwerken
197,2019-09-13T08:54:33,2019-09-13T08:54:33,nrc,Vodafone,Real time inzicht in energiegebruik biedt meerdere voordelen
198,2019-02-08T12:19:47,2019-02-08T12:19:47,nrc,Vodafone,Passagiers met een mobiliteitsbeperking door IoT geholpen op de luchthaven
199,2019-01-22T09:16:02,2019-01-22T09:16:02,nrc,Vodafone,De digitale transformatie van Yamaha op twee wielen
200,2019-01-21T15:59:44,2019-01-21T15:59:44,nrc,Vodafone,Kan een app ouderen helpen om meer te bewegen?
201,2018-12-14T08:58:09,2018-12-14T08:58:09,nrc,Vodafone,We gaan de scootermarkt disrupten
202,2018-11-14T10:35:54,2018-11-14T10:35:54,nrc,Vodafone,Al vissend watervervuiling in beeld brengen
203,2018-11-02T09:39:31,2018-11-02T09:39:31,nrc,Vodafone,De waterparadox: het belangrijkste melk-ingredient wordt vaak vergeten
204,2018-10-31T19:16:39,2018-10-31T19:16:39,nrc,Vodafone,Wereldprimeur: dijken verstevigen en op afstand monitoren
205,2018-09-28T09:54:41,2018-09-28T09:54:41,nrc,Vodafone,Smart crowd: beweging op het festivalterrein in beeld
206,2018-09-27T14:18:26,2018-09-27T14:18:26,nrc,Vodafone,Hoe mindful driving rijden veiliger zuiniger en relaxter maakt
207,2018-09-27T14:11:49,2018-09-27T14:11:49,nrc,Vodafone,Welke rondvaartboot is waar? Zo helpt fleet management de rederij
208,2018-09-13T08:09:11,2018-09-13T08:09:11,nrc,Vodafone,Internet of Things: het wordt nog rustig in het ziekenhuis
209,2018-08-28T12:45:09,2018-08-28T12:45:09,nrc,Vodafone,Geef je medicijn een beter plekje in de koelkast
210,2018-08-28T12:43:02,2018-08-28T12:43:02,nrc,Vodafone,Hoe technologie in de thuiszorg mensen helpt
211,2018-08-08T14:16:43,2018-08-08T14:16:43,nrc,Vodafone,In gesprek met je strijkijzer. Is dat straks normaal?
212,2018-08-08T14:16:29,2018-08-08T14:16:29,nrc,Vodafone,Verse groenten dankzij de juiste data: Internet of Things op het platteland
213,2018-08-08T14:16:16,2018-08-08T14:16:16,nrc,Vodafone,Duidelijk totaaloverzicht van energieverbruik dankzij nieuwe monitor
214,2018-06-29T13:09:27,2018-06-29T13:09:27,nrc,Vodafone,Slim gebruikmaken van IoT: zo doe je dat
215,2018-06-29T07:18:16,2018-06-29T07:18:16,nrc,Vodafone,Een schonere straat een schonere lucht: de slimme afvalcontainer regelt het
216,2018-03-13T13:32:06,2018-03-13T13:32:06,nrc,Vodafone,Het werken van de toekomst met de tools van nu
217,2018-03-07T12:53:12,2018-03-07T12:53:12,nrc,Vodafone,Een werkdag anno 2018: powernappen sporten en vergaderen via video
218,2018-03-07T12:52:43,2018-03-07T12:52:43,nrc,Vodafone,Binnen een seconde op kantoor dankzij de cloud
219,2018-09-19T15:12:37,2018-09-19T15:12:37,nrc,Binck,Spaar slim met targets voor de toekomst
220,2018-08-09T09:49:14,2018-08-09T09:49:14,nrc,Binck,Je geld laten beleggen door een bank is niet duur
221,2018-08-09T09:49:07,2018-08-09T09:49:07,nrc,Binck,Waarom je eerder resultaat haalt als je beleggingsdoelen stelt
222,2018-06-27T07:29:57,2018-06-27T07:29:57,nrc,Binck,Zo haal je meer rendement uit je spaargeld
223,2018-06-21T12:39:54,2018-06-21T12:39:54,nrc,Binck,Sparen in het buitenland: iets voor jou?
224,2018-05-29T11:23:46,2018-05-29T11:23:46,nrc,Binck,Met je spaargeld de grens over wel of niet doen?
225,2018-05-28T08:13:42,2018-05-28T08:13:42,nrc,Binck,Laten beleggen wordt steeds aantrekkelijker
226,2019-01-22T12:34:36,2019-01-22T12:34:36,nrc,LG,Authentieke bioscoopervaring met de nieuwste technologie
227,2019-01-22T09:24:30,2019-01-22T09:24:30,nrc,LG,De cijfers vertellen: televisie leeft
228,2018-11-22T15:53:35,2018-11-22T15:53:35,nrc,LG,Wat is oled?
229,2018-11-22T15:30:29,2018-11-22T15:30:29,nrc,LG,Waarom de televisie nog steeds belangrijk is
230,2018-11-19T14:25:03,2018-11-19T14:25:03,nrc,LG,70 jaar televisie in Nederland: van kijkkast naar wallpaper tv
231,2016-11-03T10:34:46,2016-11-03T10:34:46,nrc,Wageningen,De stad van de toekomst en de toekomst van de stad
232,2016-10-16T22:02:19,2016-10-16T22:02:19,nrc,Wageningen,Van groen worden we gezonder
233,2016-10-09T23:21:10,2016-10-09T23:21:10,nrc,Wageningen,De eindeloze kringloop in de stad van de toekomst
234,2016-10-02T22:32:42,2016-10-02T22:32:42,nrc,Wageningen,Boontjes telen met de buren
235,2016-09-26T09:05:16,2016-09-26T09:05:16,nrc,Wageningen,Frisse lucht voor de stad
236,2016-09-14T14:11:11,2016-09-14T14:11:11,nrc,Wageningen,Het klimaat verandert  hoe houden we het droog in de stad?
237,2016-09-14T14:10:58,2016-09-14T14:10:58,nrc,Wageningen,Hoe voedsel zijn weg vindt van het land naar het schap
238,2016-09-14T14:10:49,2016-09-14T14:10:49,nrc,Wageningen,Hoe houden we ons hoofd koel in de hitte?
239,2021-01-15T06:00:00,2021-01-15T06:00:00,telegraaf,Ring,Met deze slimme snufjes houd jij je huis veilig
240,2020-12-18T08:55:00,2020-12-18T08:57:29,telegraaf,Belastingdienst.,Voorkom terugbetalen: controleer de voorlopige aanslag
241,2020-12-15T09:30:00,2020-12-15T09:35:46,telegraaf,Belastingdienst.,‘We hebben nu meer opvang én meer qualitytime’
242,2020-12-09T10:04:00,2020-12-15T09:45:37,telegraaf,Belastingdienst.,‘Na mijn scheiding leerde ik een wijze les’
243,2020-12-03T10:33:00,2020-12-15T09:51:05,telegraaf,Belastingdienst.,‘Het klinkt traditioneel maar het was de slimste optie’
244,2020-10-28T08:20:00,2020-12-15T09:52:32,telegraaf,Belastingdienst.,Zo zorg je dat je niet te veel of te weinig kinderopvangtoeslag krijgt
245,2021-01-28T13:28:00,2021-01-28T15:55:16,telegraaf,ABN AMRO,‘Ik weet nu hoe ik meer financiële zekerheid kan creëren’
246,2021-01-21T10:50:50,2021-01-22T14:06:46,telegraaf,ABN AMRO,Zo maak jij de toekomst van je kinderen een beetje mooier
247,2020-12-23T07:43:00,2020-12-23T21:18:41,telegraaf,ABN AMRO,Groter wonen? Ontdek vanuit huis wat je mogelijkheden zijn
248,2020-12-10T15:45:00,2020-12-11T17:11:13,telegraaf,ABN AMRO,Van pubquiz tot bankzaken: dankzij beeldbellen kan het thuis
249,2019-09-30T04:00:00,2019-09-30T04:00:00,telegraaf,ABN AMRO,‘Vrouwen verrijken liever de wereld dan zichzelf’
250,2019-07-21T09:00:00,2019-07-21T09:16:47,telegraaf,ABN AMRO,‘Vrouwen kunnen financieel meer uit het leven halen’
251,2021-02-08T22:33:23,2021-02-08T22:34:06,telegraaf,Lego.,Amerikaan (26) komt om bij babyshower
