index,date_published,date_modified,source,sponsor,title
252,2020-12-03T09:53:00,2020-12-03T09:58:17,telegraaf,Bonaire,"Bonaire: klein van formaat, groots in genieten"
253,2020-11-29T16:22:00,2020-11-30T10:52:14,telegraaf,AmazingThailand,Vakantie in Thailand: voor elke maand een reistip
254,2020-11-29T15:08:00,2020-11-30T12:40:02,telegraaf,Fjallraven.,Dit Zweedse merk heeft de beste winterjassen
255,2020-11-19T09:29:00,2020-11-23T12:03:23,telegraaf,Budget_Thuis,Zo betaal je nooit te veel voor wat je gewoon nodig hebt
256,2020-10-21T05:50:00,2020-10-21T05:50:00,telegraaf,Oranje Handelsmissiefonds,Wil jij internationaal ondernemen? Dan is dít je kans!
257,2020-10-26T09:00:00,2020-10-26T09:04:36,telegraaf,Rijksoverheid.,Zorgen over iemand? Landelijk Meldpunt Zorgwekkend Gedrag biedt uitkomst
258,2020-10-06T04:00:00,2020-10-07T09:16:31,telegraaf,Rijksoverheid.,’Eenzaam? Die kleine eerste stap kan het verschil maken’
259,2020-10-03T06:55:55,2020-10-03T06:54:00,telegraaf,Rijksoverheid.,Minder eenzaam: ’Jan werd mijn adoptie-opa’
260,2020-10-19T13:05:00,2020-10-20T10:04:56,telegraaf,Jellow,"Van opdrachten zoeken, naar freelancers vinden"
261,2020-09-21T12:38:00,2020-09-21T12:40:18,telegraaf,Jellow,‘Bedrijven huren vaak niet de beste freelancers in’
262,2020-10-14T04:00:00,2020-10-14T09:17:24,telegraaf,Philips,Herfstige hapjes: zo maak je gezondere borrelsnacks
263,2020-09-04T14:33:07,2020-09-04T14:36:09,telegraaf,Philips,Zo maak je gezonde(re) borrelsnacks
264,2020-08-28T17:07:00,2020-09-01T09:14:29,telegraaf,Docsfair,Nieuwe bacteriën kunnen onze bodem redden
265,2020-10-30T09:01:00,2020-10-30T09:12:43,telegraaf,UWV,‘Nu heb ik juist een baan dankzij corona’
266,2020-10-22T10:00:00,2020-10-23T08:11:39,telegraaf,UWV,"Ontslag door corona: ‘Voor ik het wist, had ik een andere baan’"
267,2020-10-16T13:00:39,2020-10-16T14:10:57,telegraaf,UWV,‘Veel talent blijft onbenut door focus op diploma’s’
268,2020-09-22T16:09:00,2020-09-22T16:09:11,telegraaf,UWV,Vandra koos voor de zorg: ‘Soms straal ik helemaal’
269,2020-09-10T04:00:00,2020-09-10T04:00:00,telegraaf,UWV,Van Gooische Vrouwen tot buurtcoach in Zaans gehucht
270,2020-08-24T07:31:00,2020-08-25T17:04:16,telegraaf,UWV,‘Werkzoekenden zien vaak niet alle mogelijkheden’
271,2020-08-19T11:34:00,2020-08-31T11:31:27,telegraaf,BEAR,"Makkelijk, gezond én lekker - dit zijn de perfecte back to school snacks"
272,2020-09-16T13:16:00,2020-09-16T16:11:49,telegraaf,Curacao,Curaçao is lichtpuntje in naderende donkere dagen
273,2020-08-07T10:20:00,2020-08-07T11:40:58,telegraaf,Curacao,Paradijselijk Curaçao beleeft veilige heropening voor toeristen
274,2020-07-25T05:00:00,2020-07-25T10:02:50,telegraaf,dutchfilmworks,Win 2 kaarten voor de exclusieve voorpremière 'Alles is zoals het zou moeten zijn'
275,2020-07-25T07:00:00,2020-07-25T07:00:00,telegraaf,DisneylandParis,Waarom Disneyland Paris deze zomer magischer is dan ooit
276,2020-07-15T07:00:00,2020-07-15T07:00:00,telegraaf,DisneylandParis,Zo zorg je voor een magische zomer voor jou én je gezin
277,2020-06-08T05:00:00,2020-06-08T05:00:00,telegraaf,BestSecret1,Deze kleding past perfect bij jouw lichaamsvorm
278,2020-05-30T05:00:00,2020-05-30T05:00:00,telegraaf,Beslist.nl,Ouderwets? Echt niet! Tijd om de jeugd een modelesje te geven
279,2020-05-07T10:41:00,2020-05-07T11:12:26,telegraaf,Société_Générale,Société Générale na overname bij grootste uitgevers van beursproducten in Europa
280,2020-05-01T14:00:00,2020-05-04T09:59:56,telegraaf,Theater Rotterdam,Theater Rotterdam presenteert vergeten verhalen uit Nederlands-Indië
281,2020-04-28T07:22:00,2020-04-29T11:53:53,telegraaf,Erfrechtplanning,Gratis advies over testament in videogesprek
282,2020-07-28T08:34:00,2020-09-03T21:31:13,telegraaf,Voltaren Emulgel,Rust roest! 5 tips om in beweging te blijven bij gewrichtspijn
283,2020-03-23T10:38:00,2020-03-23T10:38:59,telegraaf,Discovery,‘Ik ben niet bang om mijn handen vuil te maken’
284,2020-11-30T06:00:00,2020-11-30T06:00:00,telegraaf,Tena,Natte onderbroek? Dat heb ik ook!
285,2020-11-14T06:00:00,2020-11-14T06:00:00,telegraaf,Tena,‘Waarom is urineverlies nog een taboe?!’
286,2018-02-19T11:08:51,2018-02-19T11:08:54,telegraaf,Tena,Ook bij KLM dreigen acties
287,2020-09-04T14:35:00,2020-09-04T14:36:01,telegraaf,Tena,‘De inlegkruisjes maken mij een stuk zekerder’
288,2021-02-09T16:54:39,2021-02-09T16:54:39,telegraaf,Tena,"Cyberpunk 2077-game gehackt, ’ook nieuwe spellen gestolen’"
289,2020-06-26T09:18:00,2020-06-26T09:18:00,telegraaf,Tena,Extra uitdaging tijdens het sporten… is dit jou weleens overkomen?
290,2020-05-04T05:00:00,2020-05-04T05:00:00,telegraaf,Tena,3 dingen die kunnen helpen bij ongewenst urineverlies
291,2020-03-30T04:30:00,2020-03-30T04:30:00,telegraaf,Tena,Natte broek na het niezen? Je bent niet de enige!
292,2020-03-27T06:00:00,2020-03-27T06:00:00,telegraaf,Coiffure Awards,Wie is volgens jou de beste kapper van 2020? Stem en win!
293,2020-02-27T09:25:00,2020-02-27T09:34:23,telegraaf,VriendenLoterij,‘Zonder Marjan had ik niet meer geleefd’
294,2020-02-27T06:00:00,2020-02-27T08:57:00,telegraaf,Engie,Gezellig met het hele gezin in de spaarstand
295,2020-02-11T05:45:00,2020-02-11T09:32:41,telegraaf,Engie,Bewezen: vrouwen zijn koele kikkers
296,2020-02-04T09:00:00,2020-11-04T10:12:53,telegraaf,Norwegian Cruise Line,Dit is waarom je nú een cruise wilt boeken
297,2020-10-12T15:15:00,2020-10-12T15:19:50,telegraaf,a.s.r.,4 manieren om je huis duurzamer te maken
298,2020-03-31T16:07:00,2020-03-31T16:07:00,telegraaf,a.s.r.,4 manieren om je huis duurzamer te maken
299,2020-01-27T10:49:00,2020-01-28T10:49:18,telegraaf,a.s.r.,"Voel je je down? Hup, naar de sportschool!"
300,2020-06-20T07:07:00,2020-06-22T07:07:18,telegraaf,TerreDesHommes,Meer handel in kinderen sinds corona
301,2020-04-17T14:12:00,2020-04-17T14:30:00,telegraaf,TerreDesHommes,’Vanaf mijn twaalfde werd ik seksueel uitgebuit door toeristen’
302,2020-02-15T08:00:00,2020-02-15T08:00:00,telegraaf,TerreDesHommes,De strijd tegen seksuele uitbuiting
303,2019-12-21T06:00:00,2019-12-21T11:06:01,telegraaf,TerreDesHommes,Kinderen van de rekening
304,2019-12-19T09:31:00,2019-12-19T15:51:50,telegraaf,Arto_Recruitment,Veroorzaakt nieuwe arbeidswet een juridisch doolhof?
305,2019-12-17T06:00:00,2019-12-17T06:00:00,telegraaf,AMCA_Cruises,Dit is de doorbraak in luxueus reizen
306,2019-12-14T06:00:00,2019-12-14T06:00:00,telegraaf,Pearle,Drie gouden regels om goed voor je ogen te zorgen
307,2019-12-13T12:37:23,2019-12-13T12:37:23,telegraaf,Erfrechtplan,Wie mag jouw beslissingen nemen als jij dat niet meer kan?
308,2019-12-06T14:56:37,2019-12-06T14:56:37,telegraaf,Zuiderzeemuseum,Kom je verwonderen in het donker
309,2019-12-06T06:30:00,2019-12-06T06:30:00,telegraaf,Exporo,Democratisering van beleggen in vastgoed
310,2019-12-20T15:27:40,2019-12-20T22:18:20,telegraaf,Expresso,Magnifiek onder de maretak
311,2019-11-28T11:08:44,2019-11-29T13:47:55,telegraaf,Expresso,Klaar om te feesten met de nieuwste looks van Expresso
312,2019-12-01T06:00:00,2019-12-01T06:00:00,telegraaf,Andalusië,In Andalusië beleef je echt een zalig kerstfeest
313,2019-12-02T12:17:34,2019-12-03T10:23:25,telegraaf,NVM,Dit kun je doen als je puberkinderen ineens meer privacy willen
314,2019-11-26T05:50:00,2019-11-26T05:50:00,telegraaf,NVM,"Hetzelfde woongenot, maar minder betalen? Dat kan!"
315,2020-11-11T06:00:00,2020-11-03T09:23:00,telegraaf,Easytoys,‘Niet iedere man is zo open-minded als de mijne’
316,2020-11-03T09:12:00,2020-11-03T10:17:35,telegraaf,Easytoys,‘We maken het extra spannend met seksspeeltjes’
317,2020-10-29T06:00:00,2020-10-29T06:00:00,telegraaf,Easytoys,‘Ik stond af te rekenen toen de vibrator begon te trillen’
318,2020-08-17T09:22:23,2020-08-18T14:59:56,telegraaf,Easytoys,WIN! De kinderen gaan weer naar school: tijd voor een spannende avond...
319,2019-11-18T06:30:00,2019-11-19T11:49:10,telegraaf,Easytoys,Zo wordt december de heetste maand van het jaar
320,2019-11-18T06:30:00,2019-11-18T06:30:00,telegraaf,Always,Angela Groothuizen: ‘Ik heb veel plasverhalen gehoord’
321,2019-11-25T06:30:00,2019-11-25T06:30:00,telegraaf,STL,Stoer achter het stuur
322,2019-11-11T06:30:00,2019-11-11T06:30:00,telegraaf,STL,‘Vrachtwagenchauffeur is een vrouwenberoep’
323,2019-11-04T12:35:00,2019-11-04T20:40:30,telegraaf,Pensioen3daagse,Nu wijzer worden over geld voor later
324,2019-10-30T05:00:00,2019-10-30T05:00:00,telegraaf,Rabobank,‘Ik wil ook later kunnen blijven doen wat ik leuk vind’
325,2019-10-28T13:15:00,2019-11-05T09:57:05,telegraaf,Handicare,Gelijkvloers wonen in huis met trappen
326,2020-08-08T04:50:00,2020-08-10T06:48:18,telegraaf,AlbertHeijn,Terug in het ritme: makkelijke lunchrecepten
327,2020-07-27T09:58:00,2020-07-27T09:58:18,telegraaf,AlbertHeijn,Waarom groente eten volgens het seizoen zo goed is
328,2020-07-11T04:50:00,2020-07-13T06:46:55,telegraaf,AlbertHeijn,"Luxe borrel, klein prijsje: zo doe je dat"
329,2020-07-09T11:34:00,2020-07-09T11:38:30,telegraaf,AlbertHeijn,‘Hot’ op de barbecue: één gerecht als eyecatcher
330,2019-12-23T05:50:00,2019-12-23T05:50:00,telegraaf,AlbertHeijn,‘Kerst vieren in de supermarkt is supergezellig!’
331,2019-12-19T05:50:00,2019-12-19T05:50:00,telegraaf,AlbertHeijn,Klassiekers met een twist op de kersttafel
332,2019-12-17T05:50:00,2019-12-17T05:50:00,telegraaf,AlbertHeijn,Zo maak je met kerst een driegangendiner voor 5 euro
333,2019-12-13T05:50:00,2019-12-13T05:50:00,telegraaf,AlbertHeijn,Dit verkoopt de supermarkt het meest met kerst
334,2020-10-15T08:53:00,2020-10-15T14:00:38,telegraaf,KPN,Enthousiaste reacties op lancering iPhone 12
335,2020-02-12T16:38:00,2020-02-13T10:20:57,telegraaf,KPN,Met de Samsung Galaxy S20 kun je de maan verkennen
336,2019-11-29T05:50:00,2019-11-29T05:50:00,telegraaf,KPN,Black Friday: dit is waar het vandaan komt
337,2019-09-23T04:00:00,2019-09-23T09:01:05,telegraaf,KPN,iPhone 11 nog steeds wereldnieuws
338,2020-08-27T08:34:00,2020-08-27T08:34:38,telegraaf,Huawei v2,Help jij je tiener met zijn of haar back to school-lijstje?
339,2020-08-06T08:26:00,2020-08-07T13:16:02,telegraaf,Huawei v2,Zó wordt meer bewegen een eitje
340,2019-12-23T12:36:00,2019-12-23T14:24:31,telegraaf,Huawei v2,Deze gadgets geven jouw gezondheid in 2020 een boost
341,2019-12-11T15:43:21,2019-12-13T12:07:56,telegraaf,Huawei v2,Met deze telefoon schiet ook jij eindelijk de perfecte decemberfoto
342,2019-09-10T10:00:00,2019-09-10T12:43:50,telegraaf,Huawei v2,Jim Bakkum en Kim Feenstra op de bres voor dove kinderen
343,2019-09-20T04:00:00,2019-09-23T14:09:57,telegraaf,Kinderpostzegels,Pianiste Iris Hond: ‘Ik weet hoe het is om geen thuis te hebben’
344,2021-02-09T09:42:32,2021-02-09T11:49:39,telegraaf,Kinderpostzegels,"Vrouw die superlijm als haarspray gebruikte, wil fabrikant aanklagen"
345,2019-09-06T09:04:00,2019-09-10T15:36:38,telegraaf,Zorgeloosch_Scheiden,Hulp bij scheiding: ’Red ik het alleen?’
346,2019-09-06T09:00:00,2019-09-10T09:09:12,telegraaf,Zorgeloosch_Scheiden,’Ik heb onderschat wat er allemaal bij een scheiding komt kijken’
347,2019-09-04T11:28:00,2019-09-10T14:02:31,telegraaf,BeSmart,Slim gebruikmaken van eerdere beleggersfouten
348,2019-11-12T05:00:00,2019-11-12T05:00:00,telegraaf,Zuid-Afrika,Op bezoek in het domein van wilde dieren
349,2019-09-25T04:00:00,2019-09-25T11:51:55,telegraaf,Zuid-Afrika,Culinaire hoogstandjes in Zuid-Afrika
350,2019-09-14T04:00:00,2019-09-14T04:00:00,telegraaf,Zuid-Afrika,Verliefd op Zuid-Afrika
351,2019-08-07T04:00:00,2019-08-07T08:15:52,telegraaf,Zuid-Afrika,De grootste vooroordelen over Zuid-Afrika
352,2019-06-29T04:00:00,2019-06-29T06:07:06,telegraaf,KLM,KLM wil luchtvaart schoner maken
353,2018-05-30T04:30:00,2018-05-30T04:30:00,telegraaf,KLM,Vlag uit voor gratis KLM-droomtickets
354,2019-10-31T13:01:00,2019-10-31T13:02:07,telegraaf,Connect Invest,Woningbelegging in Noord- en Oost-Nederland beter in balans dan Randstad
355,2019-06-27T05:00:00,2019-06-27T05:00:00,telegraaf,Connect Invest,Dubbel profijt van beleggen in zorgwoningen
356,2019-06-17T05:00:00,2019-06-17T05:00:00,telegraaf,Geld.nl,Autoverzekering jongeren twee keer zo duur
357,2020-12-07T11:57:00,2020-12-07T12:01:03,telegraaf,MeerdervoortRealEstate,Van opknapper naar duurzame huurwoning dankzij investeerders
358,2019-06-06T05:00:00,2019-06-06T09:13:23,telegraaf,MeerdervoortRealEstate,Hoe je investeert met een vaste rente in starterswoningen
359,2018-06-23T04:00:00,2019-06-05T11:55:30,telegraaf,MeerdervoortRealEstate,Iedere maand een netto bonus? Zo kan dat
360,2018-06-02T04:30:00,2019-06-05T11:56:56,telegraaf,MeerdervoortRealEstate,‘Saai beleggen’: hoog rendement en laag risico
361,2018-05-18T04:00:00,2019-06-05T11:54:41,telegraaf,MeerdervoortRealEstate,Rendement op je spaarrente
362,2019-06-25T05:00:00,2019-06-25T05:00:00,telegraaf,Credit Linked Beheer-,‘Lage rente stuwt huurprijzen vrije sector verder op’
363,2019-06-04T05:00:00,2019-06-04T07:27:46,telegraaf,Credit Linked Beheer-,’Saai’ fonds is een bewuste keuze
364,2019-06-03T12:45:00,2019-06-03T12:47:19,telegraaf,Special Beleggen,‘Saai’ fonds is bewuste keuze
365,2019-05-29T15:40:00,2019-05-29T15:41:13,telegraaf,Special Beleggen,Duurzaam beleggen: hoe ver ga je?
366,2019-05-29T15:25:00,2019-05-29T15:26:32,telegraaf,Special Beleggen,Wijzer in beleggen na 10 vragen aan…
367,2019-05-29T15:12:00,2019-05-29T15:13:22,telegraaf,Special Beleggen,‘Ik ben het blondje tussen de experts’
368,2019-05-29T14:11:16,2019-05-29T14:04:00,telegraaf,Special Beleggen,Groei van je vermogen dankzij groei van steden
369,2019-05-29T13:55:00,2019-05-29T14:01:07,telegraaf,Special Beleggen,Vind de juiste broker!
370,2019-05-29T13:47:00,2019-05-29T13:55:12,telegraaf,Special Beleggen,Interesse in opknappers
371,2019-05-29T13:35:00,2019-05-29T13:41:48,telegraaf,Special Beleggen,Investeren in supermarkten
372,2019-06-11T05:00:00,2019-06-11T05:00:00,telegraaf,Zalando,Zo kom je cool de zomer door als man
373,2019-05-29T05:00:00,2019-05-29T14:46:34,telegraaf,Zalando,Karige sportzomer blijkt ideaal om zelf fit te worden
374,2020-03-11T10:00:00,2020-03-11T11:52:49,telegraaf,Annexum,Scherpe concurrentie stuwt omzet supermarktsector
375,2020-01-10T12:27:00,2020-01-10T13:55:42,telegraaf,Annexum,Consument blijft trouw aan fysieke supermarkt
376,2019-11-14T06:30:00,2019-11-15T10:50:32,telegraaf,Annexum,Deze woningen vormen buitenkans voor beleggers
377,2019-09-26T05:00:00,2019-09-26T05:00:00,telegraaf,Annexum,Investeren in duurzame woonoplossingen voor starters
378,2019-05-24T09:39:00,2019-05-24T09:39:16,telegraaf,Annexum,Supermarkten worden leuker en innovatiever
379,2019-05-16T04:00:00,2019-05-17T14:01:58,telegraaf,Annexum,Geld verdienen aan boodschappen doen
380,2019-05-15T05:00:00,2019-05-15T06:32:24,telegraaf,eTorro,Krijgen we een nieuwe campinghausse?
381,2019-05-13T05:00:00,2019-05-13T05:00:00,telegraaf,Volkswagen,Studenten krijgen praktijkles via Instagram
382,2019-05-10T12:30:00,2019-05-10T12:30:00,telegraaf,Nederlandse Loterij,‘Zonder hen misschien geen goud’
383,2019-05-09T22:45:00,2019-05-09T22:45:00,telegraaf,Nederlandse Loterij,‘Dankbaar voor goud na nekoperatie’
384,2014-08-31T10:41:12,2014-08-31T10:41:12,telegraaf,De Rabobank,Kleiner kapitaalbelang UBS in Heineken
385,2019-04-30T05:00:00,2019-04-30T05:00:00,telegraaf,De Rabobank,‘Makkelijk betalen hoort bij uitgaan’
386,2019-04-25T05:00:00,2019-05-01T09:50:49,telegraaf,De Rabobank,Sneller geld na betaling met creditcard
387,2019-04-23T06:00:00,2019-05-01T09:52:36,telegraaf,De Rabobank,Pasjes weg! We gaan betalen met horloge en ring
388,2019-04-25T04:00:00,2019-06-04T08:06:33,telegraaf,Samsung,Dit is de ultieme bingewatch smartphone
389,2019-04-15T04:00:00,2019-04-15T08:41:27,telegraaf,Samsung,Professionele camera-apparatuur sterft uit
390,2019-04-11T04:00:00,2019-04-11T04:00:00,telegraaf,Batavus,Nederland massaal op de e-bike
391,2020-09-14T05:00:00,2020-09-14T12:11:50,telegraaf,Toyota,Nederland switcht naar hybride
392,2020-04-09T05:18:00,2020-04-09T05:18:30,telegraaf,Toyota,Zo rijd je van Amsterdam naar Lyon zonder te tanken
393,2020-03-30T04:00:00,2020-03-30T14:37:33,telegraaf,Toyota,Deze nieuwe tool laat zien welke auto het beste bij jou past
394,2020-03-17T05:50:00,2020-04-01T09:51:22,telegraaf,Toyota,Automerken racen voor beter milieu én tegen boetes
395,2020-03-05T05:50:00,2020-03-05T05:50:00,telegraaf,Toyota,Zo leg je de meeste kilometers zonder tanken af
396,2020-02-21T05:50:00,2020-02-21T05:50:00,telegraaf,Toyota,Alles wat je wil weten over auto’s van de toekomst
397,2020-02-14T05:45:00,2020-02-20T12:02:19,telegraaf,Toyota,Met deze auto’s rijden we een nieuw tijdperk binnen
398,2020-01-02T05:50:00,2020-02-14T13:12:44,telegraaf,Toyota,Eigen auto en bijna geen onderhoudskosten
399,2020-03-03T05:50:00,2020-03-03T08:32:32,telegraaf,Mogelijk,Vastgoed op alternatieve wijze financieren neemt een vlucht
400,2019-03-25T05:00:00,2019-03-25T07:49:30,telegraaf,Mogelijk,Oplossing voor ondernemers na revolutie bij banken
401,2019-03-22T08:21:00,2019-03-22T08:46:43,telegraaf,Molenaar_Badkamers,Help je ouders met een veilig huis
402,2019-03-13T09:27:00,2019-03-13T09:39:59,telegraaf,Molenaar_Badkamers,Nieuwe badkamer in een dag
403,2019-04-05T05:00:00,2019-04-05T05:00:00,telegraaf,Qredits,‘Ik groeide uit mijn garagebox’
404,2019-03-22T06:00:00,2019-03-22T11:05:37,telegraaf,Qredits,Een unieke kans op een nieuw leven
405,2019-03-08T06:00:00,2019-03-08T11:19:53,telegraaf,Qredits,Bloeiende onderneming start in de kroeg
406,2020-12-14T12:12:00,2020-12-14T12:14:01,telegraaf,Belastingdienst2019,‘We hebben nu meer opvang én meer qualitytime’
407,2020-09-14T12:43:00,2020-09-15T08:19:06,telegraaf,Belastingdienst2019,Nieuwe baan of voor jezelf begonnen? Praat mee!
408,2019-11-05T05:50:00,2019-11-05T05:50:00,telegraaf,Belastingdienst2019,Voor ondernemers nadert belangrijke datum
409,2019-10-25T04:00:00,2019-10-25T10:35:20,telegraaf,Belastingdienst2019,Kleine ondernemer en tijd besparen met uw btw-aangifte?
410,2019-10-10T04:00:00,2019-10-10T04:00:00,telegraaf,Belastingdienst2019,Minder papierwerk mogelijk door nieuwe btw-regeling
411,2019-09-26T04:00:00,2019-09-26T04:00:00,telegraaf,Belastingdienst2019,Wil jij af van btw-aangifte? Dat kan misschien
412,2019-03-22T13:20:00,2019-03-22T13:21:04,telegraaf,Belastingdienst2019,Wat voor ondernemer ben jij?
413,2019-03-22T05:00:00,2019-03-22T05:00:00,telegraaf,Belastingdienst2019,Jij en je partner uit elkaar? Let op met je belastingaangifte
414,2019-02-08T05:00:00,2019-07-24T14:50:45,telegraaf,EuronextNieuw,Webinar: kansen in commercieel vastgoed
415,2019-03-14T14:31:00,2019-03-14T14:41:47,telegraaf,ABNTIKKIE,Ook onderweg kan eten lekker zijn
416,2019-02-21T06:00:00,2019-02-21T09:34:41,telegraaf,ABNTIKKIE,’Een Tikkie zorgt voor betere band met je klant’
417,2019-02-07T05:00:00,2019-02-07T06:49:04,telegraaf,ABNTIKKIE,Ondernemers: met Tikkie krijg je supersnel je geld
418,2019-02-09T07:00:00,2019-02-09T07:53:04,telegraaf,Inventumnieuw,Zo pomp je warmte en geld je huis in
419,2019-01-26T06:00:00,2019-01-29T08:50:27,telegraaf,Inventumnieuw,Laat jij je geld ook het huis uitvliegen?
420,2020-12-30T06:00:00,2020-12-30T06:00:00,telegraaf,Beursgenoten,Deze drie aandelen kunnen in 2021 gaan knallen
421,2020-06-09T05:50:00,2020-06-08T11:52:00,telegraaf,Beursgenoten,‘Beleggers kijken door verkeerde kant van de trechter’
422,2020-05-12T05:50:00,2020-05-12T12:59:16,telegraaf,Beursgenoten,Na prijsdaling veel winstkansen met gedaalde olieaandelen
423,2020-04-07T05:50:00,2020-04-07T05:50:00,telegraaf,Beursgenoten,Wat zijn kansrijke aandelen in huidige crisis?
424,2020-03-19T08:25:00,2020-03-19T08:28:19,telegraaf,Beursgenoten,Deze aandelen blijven gevaarlijk op Beursplein 5!
425,2019-06-24T04:00:00,2019-06-24T04:00:00,telegraaf,Beursgenoten,Zo ga je op weg naar het eerste miljoen…
426,2019-03-28T06:00:00,2019-03-28T15:09:13,telegraaf,Beursgenoten,Beursgoeroe Schaaij over beleggers en depressie
427,2019-03-14T06:00:00,2019-03-14T06:00:00,telegraaf,Beursgenoten,Topbelegger tipt over kansrijke overname
428,2019-10-13T04:00:00,2019-10-13T04:00:00,telegraaf,Politie,‘Het voelde alsof ik zélf gestolen had’
429,2018-12-23T05:00:00,2018-12-23T05:00:00,telegraaf,Politie,Grote trauma’s achter goedkope telefoons
430,2018-12-12T10:38:00,2018-12-12T10:38:46,telegraaf,Gamma,Twaalf jaar liefde in huis voor een prikkie
431,2018-11-27T05:00:00,2018-11-27T13:41:12,telegraaf,Gamma,Run op kerstbomen voor pakjesavond
432,2018-12-24T05:00:00,2018-12-24T07:54:06,telegraaf,LG,We gaan tv-kijken op behang en ertegen praten
433,2018-12-17T05:00:00,2018-12-17T05:00:00,telegraaf,LG,Tv-liefhebbers in de wolken met nieuwe technologie
434,2018-12-10T05:00:00,2018-12-10T05:00:00,telegraaf,LG,De televisie is nog zó belangrijk voor ons
435,2018-12-01T05:00:00,2018-12-01T05:00:00,telegraaf,LG,Alles over het ultieme tv-kijken
436,2018-11-24T05:00:00,2018-11-25T10:04:59,telegraaf,LG,De tv is 70 en maakt zich op voor oprolbaar beeldscherm
437,2020-11-03T05:50:00,2020-11-03T08:18:16,telegraaf,Shell2,Een stroom aan vragen over elektrisch rijden: zo zit het!
438,2019-10-03T04:00:00,2019-10-03T04:00:00,telegraaf,Shell2,‘We zijn de volgende generatie iets verplicht’
439,2019-05-14T04:00:00,2019-05-22T14:15:52,telegraaf,Shell2,Is ademhalen slecht voor het milieu?
440,2019-04-19T04:00:00,2019-05-22T14:15:36,telegraaf,Shell2,Vrijwillig bijbetalen aan de pomp
441,2019-04-10T04:00:00,2019-04-10T07:51:49,telegraaf,Shell2,Vijf miljoen bomen erbij; hoe goed is dat?
442,2019-01-16T05:00:00,2019-01-16T05:00:00,telegraaf,Shell2,‘Vrachtschepen worden zeilboten’
443,2018-12-12T05:00:00,2018-12-12T05:00:00,telegraaf,Shell2,Sleutelrol voor start-ups in race naar schonere wereld
444,2018-11-14T05:00:00,2018-11-14T05:00:00,telegraaf,Shell2,Shell maakt vaart met snelle tankstations elektrische auto
445,2019-07-07T05:00:00,2019-07-07T05:00:00,telegraaf,Cybercrime,Violet Falkenburg opgelicht door ‘dochter’
446,2018-11-18T05:00:00,2018-11-18T05:00:00,telegraaf,Cybercrime,Internetcriminelen lichten gewone Nederlanders op
447,2018-10-28T05:38:00,2018-10-28T05:39:01,telegraaf,Cybercrime,Online gevaar neemt fors toe
448,2018-03-29T05:00:00,2018-07-05T14:41:58,telegraaf,Cybercrime,Criminelen slaan toe op het web
449,2018-11-15T05:00:00,2018-11-15T05:00:00,telegraaf,NNIP,Impact beleggen verandert de (beleggings)wereld
450,2018-11-05T05:00:00,2018-11-05T05:00:00,telegraaf,NNIP,Diepgaande analyse schept inzicht in impactvolle bedrijven
451,2018-10-26T04:00:00,2018-10-26T04:00:00,telegraaf,NNIP,Impact beleggen is snelgroeiende beleggingsstrategie
452,2018-10-17T08:15:00,2018-10-17T08:38:09,telegraaf,NNIP,‘Beleggen in oplossingen voor maatschappelijke problemen’
453,2018-10-17T04:00:00,2018-10-17T04:00:00,telegraaf,Axento2,Vermogen opbouwen in een warm bad
454,2018-12-20T10:24:00,2019-02-19T09:39:15,telegraaf,!Academie_voor_gedragskennis,Heb begrip voor een chagrijnige ober
455,2018-10-12T03:00:00,2018-10-14T16:08:27,telegraaf,!Academie_voor_gedragskennis,Waarom je niet zo rationeel bent als je denkt
456,2018-10-24T04:00:00,2018-10-24T09:52:34,telegraaf,FFP,‘Pluk de dag! Ook over 30 jaar’
457,2018-10-02T14:25:00,2018-10-02T15:30:17,telegraaf,FFP,Geldproblemen dreigen voor jongeren
458,2018-10-02T05:12:00,2018-10-02T11:43:25,telegraaf,QWR,Uniek natuurverschijnsel op de Veluwe
459,2019-06-13T05:00:00,2019-06-13T05:00:00,telegraaf,Pictet,Spaargeld kan groeien door populariteit steden
460,2019-05-29T05:00:00,2019-05-29T05:00:00,telegraaf,Pictet,Zo houden we overvolle steden comfortabel
461,2019-05-14T05:00:00,2019-05-14T05:00:00,telegraaf,Pictet,Druk op steden biedt financiële kansen
462,2018-10-02T05:13:00,2018-10-02T08:43:18,telegraaf,Pictet,Zo word je rijk van een betere wereld
463,2018-09-19T07:50:00,2018-09-19T11:26:16,telegraaf,Beleggen2,Mee-investeren in de vrije sector
464,2018-09-18T13:19:00,2018-09-18T13:44:15,telegraaf,Beleggen2,Beleggen buiten de gebaande paden
465,2018-09-18T12:01:00,2018-09-18T12:38:57,telegraaf,Beleggen2,Investeren met oog voor milieu
466,2018-09-18T04:00:00,2018-09-18T04:00:00,telegraaf,Beleggen2,Wel of niet beleggen?
467,2018-11-20T04:00:00,2018-11-20T04:00:00,telegraaf,Spotcap,Onterechte vooroordelen over alternatieve financiering
468,2018-10-15T03:00:00,2019-04-03T14:22:10,telegraaf,Spotcap,Eenvoudig financiële ruimte voor ondernemers
469,2018-09-12T04:00:00,2018-09-12T13:05:01,telegraaf,Spotcap,Financiering aanvragen in je pyjama
470,2018-09-04T04:54:00,2018-09-04T04:54:58,telegraaf,DOVE,‘Mijn ziekte heeft ook een mooie kant’
471,2018-08-30T04:58:00,2018-08-30T04:58:32,telegraaf,DOVE,Deze man is het baken in de strijd tegen ALS
472,2018-08-27T05:00:00,2018-08-29T08:20:09,telegraaf,DOVE,‘Door ALS ben ik intenser gaan leven’
473,2018-08-03T04:00:00,2018-08-03T06:51:19,telegraaf,BankGiroLoterij,Hoge entreeprijs grootste ergernis bij uitstapjes
474,2019-03-04T05:00:00,2019-03-04T14:24:55,telegraaf,Get_into_the_Future,Je dromen waarmaken; je kunt het leren
475,2021-02-09T16:56:30,2021-02-09T17:06:39,telegraaf,Get_into_the_Future,Hoop op versoepelingen door dalende cijfers
476,2019-01-29T05:00:00,2019-01-29T05:00:00,telegraaf,Get_into_the_Future,Pijn zit vaak echt tussen je oren
477,2021-02-09T07:00:00,2021-02-09T08:34:40,telegraaf,Get_into_the_Future,Schaamrood in Brussel na afgang Borrell
478,2017-12-22T13:58:08,2017-12-22T13:58:08,telegraaf,Get_into_the_Future,„Ik gaf mijn carrière op om Malala te helpen bij haar strijd”
479,2017-12-08T10:17:44,2017-12-08T14:03:32,telegraaf,Get_into_the_Future,’Robots geven onze menselijkheid terug’
480,2017-12-04T15:20:08,2017-12-04T15:20:08,telegraaf,Get_into_the_Future,Het einde van de huisarts?
